show_id,type,title,director,cast,country,date_added,release_year,rating,duration,listed_in,description
s5144,TV Show,Reggie Yates Outside Man,,Reggie Yates,United Kingdom," December 15, 2017",2017,TV-MA,2 Seasons,"British TV Shows, Docuseries, International TV Shows","Award-winning filmmaker Reggie Yates travels around the world tackling big issues such as gun violence, racism, gay rights and addiction."
s5147,TV Show,Reign,,"Adelaide Kane, Megan Follows, Torrance Coombs, Toby Regbo, Jenessa Grant, Celina Sinden, Caitlin Stasey, Anna Popplewell, Alan Van Sprang, Rossif Sutherland, Jonathan Keltz, Sean Teale, Craig Parker",United States,"September 5, 2017",2017,TV-14,4 Seasons,TV Dramas,"This vivid historical drama series tells of the rise to power of Mary, Queen of Scots, amid a court full of sexual and political intrigue."
s5160,Movie,Rememory,Mark Palansky,"Peter Dinklage, Julia Ormond, Martin Donovan, Anton Yelchin, Henry Ian Cusick, Evelyne Brochu, Matt Ellis, Colin Lawrence, Chad Krowchuk, Gracyn Shinyei","United Kingdom, United States, Canada","June 1, 2020",2017,PG-13,112 min,"Dramas, Sci-Fi & Fantasy","A psychologist is murdered after unveiling a breakthrough invention that extracts memories, spurring a fixated former patient to hunt for answers."
s5168,Movie,Residente,René Pérez Joglar,René Pérez Joglar,United States,"January 1, 2018",2017,TV-MA,97 min,"Documentaries, Music & Musicals",The results of a DNA test spur Puerto Rican rap icon Residente to set out on a global voyage in search of his roots and fresh musical inspiration.
s5173,Movie,Resurface,"Josh Izenberg, Wynn Padula",,United States,"September 1, 2017",2017,TV-MA,28 min,"Documentaries, Sports Movies",A suicidal war veteran finds like-minded souls in a surf therapy program that helps traumatized soldiers heal while riding the waves.
s5175,Movie,Retablo,Álvaro Delgado-Aparicio L.,"Junior Béjar Roca, Amiel Cayo, Magaly Solier, Hermelinda Luján, Mauro Chuchón, Claudia Solís, Coco Chiarella","Peru, Germany, Norway","July 30, 2020",2017,TV-MA,102 min,"Dramas, International Movies","High in the Andes, a teenage boy and his father work together as artisans. But their bond is shattered when the son learns of his father's secret life."
s5180,TV Show,Revenge,,"Lalita Panyopas, Saksit Tangtong, Tao Somchai Khemklad, Tack Parunyu Rojanawuttitum, Pongsatorn Jongwilas, Chaleumpol Tikumpornteerawong, Akarin Akaranitimaytharatt, Kanthi Pitithan, Plerng Pollapakk Vacharaponghiran, Kritteera Inpornwijit",,"May 2, 2019",2017,TV-MA,1 Season,"Crime TV Shows, International TV Shows, TV Dramas","After a mother and her daughter are gang-raped by seven men, the daughter suffers a mental breakdown, and the single mom sets out to get revenge."
s5186,Movie,Revolt,Joe Miale,"Lee Pace, Bérénice Marlohe, Jason Flemyng, Sibulele Gcilitshana, Wandile Molebatsi, Sekoati Sk Tsubane, Leroy Gopal, Welile Nzunza, Patrick Bakoba, Tom Fairfoot",United Kingdom,"March 31, 2018",2017,R,87 min,"Action & Adventure, Sci-Fi & Fantasy","Following a devastating alien invasion, an American soldier and a French foreign aid worker attempt to find refuge in the Kenyan countryside."
s5187,TV Show,Revolting Rhymes,"Jani Lachauer, Jakob Schuh","Rob Brydon, Bertie Carvel, Gemma Chan, Dominic West, Isaac Hempstead Wright, Bel Powley, Tamsin Greig, Rose Leslie, David Walliams",United Kingdom,"February 1, 2018",2017,TV-PG,1 Season,"British TV Shows, Kids' TV",Popular fairy tales take on a darkly comic edge in these short animated films based on a book by Roald Dahl and illustrator Quentin Blake.
s5188,TV Show,Revolutionary Love,,"Choi Si-won, Kang So-ra, Gong Myoung",South Korea,"June 1, 2020",2017,TV-MA,1 Season,"International TV Shows, Korean TV Shows, Romantic TV Shows",A third-generation chaebol falls in love with a woman who opens his eyes to the struggles of the working class and inspires him to make a difference.
s5211,TV Show,Rimba Racer,,"Steven Tan, Iain McNally, Chi-Ren Choong, Kevin Adrian Barnaby, Tikriti Shabudin, Sherilyn Pang Li Ching, Azman Zulkiply",Malaysia,"April 5, 2019",2017,TV-PG,1 Season,Kids' TV,"In this animated action series, a rookie driver seeks glory in a world-class auto race, but he’ll need more than just his talent behind the wheel."
s5214,Movie,Rip Tide,Rhiannon Bannenberg,"Debby Ryan, Genevieve Hegney, Andrew Creer, Naomi Sequeira, Aaron Jeffery, Valerie Bader, Jeremy Lindsay Taylor, Danielle Carter, Marcus Graham, Kimie Tsukakoshi","Australia, United Arab Emirates","January 15, 2018",2017,TV-PG,87 min,"Children & Family Movies, Dramas, Sports Movies","Following an embarrassing viral video, a New York model decides to escape from her suffocating existence by visiting her faraway aunt in Australia."
s5216,TV Show,Ripper Street,,"Matthew Macfadyen, Jerome Flynn, Adam Rothenberg, David Wilmot, MyAnna Buring, David Dawson, Amanda Hale, Charlene McKenna, Jonathan Barnwell, Clive Russell","United Kingdom, Ireland","September 8, 2017",2017,TV-MA,5 Seasons,"British TV Shows, Crime TV Shows, TV Dramas","It's been six months since the last Jack the Ripper killing, and East London is hopeful that his reign of terror might have run its course."
s5251,Movie,Rodney Carrington: Here Comes the Truth,Brandon Jones,Rodney Carrington,United States,"October 3, 2017",2017,TV-MA,66 min,Stand-Up Comedy,"Raunchy country comic and musician Rodney Carrington jokes and sings about life in his 40s, poking fun at sex, relationships and gaining weight."
s5252,Movie,Rodney King,Spike Lee,Roger Guenveur Smith,United States,"April 28, 2017",2017,TV-MA,53 min,Dramas,Roger Guenveur Smith gives voice to the man at the center of the brutal police beating that helped fuel the 1992 LA riots. Spike Lee directs.
s5253,Movie,Roger Corman's Death Race 2050,G.J. Echternkamp,"Manu Bennett, Malcolm McDowell, Marci Miller, Burt Grinstead, Folake Olowofoyeku, Ramsey Moore, Yancy Butler, Charlie Farrell, Shanna Olson",United States,"January 17, 2017",2017,R,93 min,"Action & Adventure, Sci-Fi & Fantasy","In this dystopian sequel, kills equal points in a violently gory annual cross-country road race sponsored by the United Corporations of America."
s5259,Movie,Roll With Me,,,United States,"December 1, 2018",2017,TV-MA,90 min,"Documentaries, Sports Movies","Backed by a crew of unlikely allies, newly sober paraplegic Gabriel Cordell teams up with his nephew for a grueling wheelchair trek across America."
s5277,Movie,Room for Rent,Matthew Atkinson,"Brett Gelman, Mark Little, Carla Gallo, Stephnie Weir, Patrick J. Adams, Mark McKinney",Canada,"March 1, 2019",2017,TV-MA,89 min,"Comedies, Independent Movies","To save his parents’ home, a lottery-squandering 32-year-old man sublets a room to a disarmingly creepy tenant."
s5283,Movie,Rory Scovel Tries Stand-Up for the First Time,Scott Moran,Rory Scovel,United States,"June 20, 2017",2017,TV-MA,66 min,Stand-Up Comedy,"Comedian Rory Scovel storms the stage in Atlanta, where he shares unfocused thoughts about things that mystify him, relationships and the ""Thong Song."""
s5297,Movie,Rukh,Atanu Mukherjee,"Adarsh Gourav, Manoj Bajpayee, Smita Tambe, Kumud Mishra",India,"April 1, 2018",2017,TV-MA,103 min,"Dramas, Independent Movies, International Movies","Following the untimely death of his father, a young man begins to reconnect with his family while uncovering some difficult truths."
s5307,Movie,Running Shaadi,Amit Roy,"Amit Sadh, Tapsee Pannu, Arsh Bajwa, Brijendra Kala, Mahavir Bhullar, Pankaj Jha, Neeta Mohindra",India,"April 30, 2018",2017,TV-14,115 min,"Comedies, International Movies, Romantic Movies","A Bihari migrant runs a successful service to help couples elope, until the daughter of his former boss stirs the pot."
s5311,Movie,Russell Howard: Recalibrate,Peter Orton,Russell Howard,United Kingdom,"December 19, 2017",2017,TV-MA,69 min,Stand-Up Comedy,"Self-deprecating comic Russell Howard plows ahead through politics, porn, social media and his own shortcomings. Yet he somehow keeps it positive."
s5320,Movie,Ryan Hamilton: Happy Face,Marcus Raboy,Ryan Hamilton,United States,"August 29, 2017",2017,TV-14,57 min,Stand-Up Comedy,"Small-town import Ryan Hamilton charms New York with folksy comic observations on big-city life, hot-air ballooning and going to Disney World alone."
s5330,TV Show,Sab Jholmaal Hai,Vijay Roche,,India,"October 18, 2020",2017,TV-Y7,3 Seasons,"Kids' TV, TV Comedies","In this madcap comedy, two mischievous cats, a talking parrot and a high-strung dog keep getting into trouble while their human is away."
s5334,Movie,Sad Hill Unearthed,Guillermo de Oliveira,,Spain,"December 15, 2018",2017,TV-14,83 min,"Documentaries, International Movies","An eclectic group of fans of 1966's ""The Good, the Bad and the Ugly"" attempt to restore the cemetery set in Spain where the movie's climax was filmed."
s5342,Movie,Sahara,Pierre Coré,"Robert Naylor, Angela Galuppo, Daniel Brochu, Mark Hauser, Andrew Shaver, Mathew Mackay, Richard Dumont, Brady Moffatt, Rick Jones, Nadia Verrucci, Sonja Ball","France, Canada","May 12, 2017",2017,TV-Y7,86 min,Children & Family Movies,"When his new love is captured by an evil snake charmer, a young cobra and his scorpion best friend set out across the desert on a wild rescue mission."
s5362,Movie,Samantaral,Partha Chakraborty,"Riddhi Sen, Parambrata Chatterjee, Soumitra Chatterjee, Aparajita Adhya, Tanusree Chakraborty, Kushal Chakraborty, Anindya Banerjee, Surangana Banerjee",India,"September 15, 2018",2017,TV-MA,110 min,"Dramas, International Movies","On a family visit, a young man and his girlfriend set out to discover why his eccentric uncle has been mysteriously confined to one room for years."
s5364,Movie,Samarppanam,K. Gopinathan,"Virginia Rodriguez, Anil Nedumangad, Santhosh Keezhattoor, Indrans, P. Balachandran, Renji Panicker, Gopalan",India,"March 1, 2018",2017,TV-PG,116 min,"Dramas, International Movies","When a young girl is killed in a suspicious train accident, three very different lives become intertwined in their quest for answers."
s5365,Movie,Same Kind of Different as Me,Michael Carney,"Greg Kinnear, Renée Zellweger, Djimon Hounsou, Jon Voight, Olivia Holt",United States,"August 17, 2018",2017,PG-13,119 min,"Dramas, Faith & Spirituality",A wealthy couple whose marriage is on the rocks befriends a local homeless man who changes their perspectives in this inspiring true story.
s5371,TV Show,Samurai Gourmet,,"Naoto Takenaka, Tetsuji Tamayama, Honami Suzuki",Japan,"March 17, 2017",2017,TV-PG,1 Season,"International TV Shows, TV Dramas",Recent retiree Takeshi rediscovers his passion for food and life by getting in touch with his inner warrior and eating what he truly desires.
s5374,Movie,Sand Castle,Fernando Coimbra,"Nicholas Hoult, Logan Marshall-Green, Henry Cavill, Glen Powell, Neil Brown Jr., Beau Knapp, Sammy Sheik, Gonzalo Menendez",United States,"April 21, 2017",2017,TV-MA,113 min,"Action & Adventure, Dramas, Independent Movies","After the invasion of Iraq in 2003, a reluctant soldier's platoon is dispatched on a dangerous mission to repair a hostile village's water system."
s5376,Movie,Sandy Wexler,Steven Brill,"Adam Sandler, Jennifer Hudson, Kevin James, Terry Crews, Rob Schneider, Colin Quinn, Nick Swardson, Lamorne Morris, Arsenio Hall, Jamie Gray Hyder",United States,"April 14, 2017",2017,TV-14,131 min,Comedies,"When a hapless but dedicated talent manager signs his first client who actually has talent, his career finally starts to take off."
s5390,Movie,Sarah Silverman A Speck of Dust,Liam Lynch,Sarah Silverman,United States,"May 30, 2017",2017,TV-MA,71 min,Stand-Up Comedy,"In her first comedy special post-health scare, Sarah Silverman shares a mix of fun facts, sad truths and yeah-she-just-went-there moments."
s5399,Movie,Sarvopari Palakkaran,Venugopan,"Anoop Menon, Alencier Ley Lopez, Balu Varghese, Aparna Balamurali, Anu Sithara, Gayathri Arun, Nandu, Chali Pala",India,"July 1, 2018",2017,TV-14,133 min,"Dramas, International Movies","In the course of a human trafficking investigation, a conservative cop crosses paths with an artist-activist in a clash of worldviews."
s5400,Movie,Sat Shri Akaal England,Vikram Pradhan,"Ammy Virk, Monica Gill, Karamjit Anmol, Sardar Sohi, Jarnail Singh, Satwant Kaur, Harby Sangha, Baljinder Darapuri",India,"October 1, 2018",2017,TV-14,127 min,"Comedies, Dramas, International Movies","After several failed attempts to obtain a visa, a man desperate to escape Punjab pays a British woman to marry him so he can move to England."
s5405,Movie,Satria Heroes: Revenge of the Darkness,"Kenzo Maihara, Amandha Wyanto","Christian Loho, Fernando Surya, Yayan Ruhian, Stella Cornelia, Yui Takano, Safira Ratu, Faris Fadjar Munggaran, Adhitya Alkatiri",Indonesia,"September 10, 2020",2017,TV-G,92 min,Children & Family Movies,"As he rebuilds society in a parallel universe, a superhero must return to Earth to help his equally powerful friend defend the planet from evil rivals."
s5408,Movie,Saturday Church,Damon Cardasis,"Luka Kain, Regina Taylor, Margot Bingham, Marquis Rodriguez, Mj Rodriguez, Indya Moore, Alexia Garcia, Kate Bornstein, Peter Kim, Jaylin Fletcher",United States,"October 6, 2020",2017,TV-MA,83 min,"Dramas, LGBTQ Movies",A teen struggling with gender identity and family tensions seeks hope and support in New York City's underground LGBTQ ballroom community.
s5411,Movie,Savage Dog,Jesse V. Johnson,"Scott Adkins, Juju Chan, Marko Zaror, Vladimir Kulich, Charles Fathy, Matthew Marsden, Keith David, Luke Massy",United States,"November 1, 2017",2017,TV-MA,95 min,"Action & Adventure, Independent Movies",A former professional boxer serving time in a brutal labor camp must fight incredible odds to gain his freedom and avenge an act of violence.
s5413,TV Show,Save Me,,"Taecyeon, Seo Ye-ji, Cho Seong-ha, Woo Do‑hwan, Son Byung-ho, Kim Kwang-gyoo, Yun Yoo-sun, Park Ji-young, Jeong Hae-gyoon, Jang Hyeok-jin",South Korea,"January 1, 2020",2017,TV-MA,1 Season,"International TV Shows, Korean TV Shows, TV Dramas",Four young men come to the rescue of a former classmate whose family has been sucked into the clutches of a religious cult and its charismatic leader.
s5416,Movie,Saving Capitalism,Jacob Kornbluth,Robert Reich,United States,"November 21, 2017",2017,TV-PG,73 min,Documentaries,Former Secretary of Labor Robert Reich meets with Americans from all walks of life as he chronicles a seismic shift in the nation's economy.
s5423,Movie,Scales: Mermaids Are Real,Kevan Peterson,"Emmy Perry, Morgan Fairchild, Elisabeth Röhm, Nikki Hahn, Jack Dylan Grazer, Stephen Snedden, Noree Victoria, Sterling Sulieman",United States,"January 23, 2020",2017,PG,93 min,Children & Family Movies,A seemingly ordinary girl learns she will turn into a mermaid on her 12th birthday and be forced to leave her life on land behind.
s5465,Movie,Secret Superstar,Advait Chandan,"Zaira Wasim, Meher Vij, Raj Arjun, Aamir Khan, Tirth Sharma",India,"March 23, 2018",2017,TV-14,150 min,"Dramas, International Movies, Music & Musicals",A talented teenage singer-songwriter living amid domestic abuse becomes a YouTube sensation after a video in which she hides her identity goes viral.
s5480,Movie,Security,Alain Desrochers,"Antonio Banderas, Ben Kingsley, Liam McIntyre, Cung Le, Katherine de la Rocha, Chad Lindberg, Jiro Wang, Gabriella Wright, Shari Watson, John Strong",United States,"October 3, 2017",2017,R,92 min,Action & Adventure,"After taking a job as a mall security guard, a former Marine steps up to protect a young girl who's being hunted by heavily armed mercenaries."
s5481,TV Show,See You in Time,,"Hans Chung, Mini Tsai, Albee Huang, David Chiu, Johnny Yang, Kuan Lin, Ray Yang, Liu Yu Shan",,"January 4, 2019",2017,TV-14,1 Season,"International TV Shows, Romantic TV Shows, TV Dramas",A series of mysterious text messages from the future sends ripples through the lives of a delivery woman and an accomplished cyclist.
s5498,Movie,"Septiembre, un llanto en silencio",Kenneth Müller,"Saúl Lisazo, Mario Zaragoza, Juan Pablo Olyslager, Costanza Andrade",Guatemala,"March 10, 2018",2017,TV-MA,69 min,"Dramas, Independent Movies, International Movies","After a terrorist attack in Guatemala, a baby is rendered deaf and motherless and her father is left to raise her alone."
s5514,TV Show,Seven and Me,,"Leila Jolene, Flavio Parenti, Josefin Asplund",France,"October 15, 2017",2017,TV-Y,1 Season,Kids' TV,A little girl discovers she’s the modern-day descendant of Snow White when seven dwarfs arrive at her suburban home to serve as her guardian angels.
s5518,Movie,Seven Sundays,Cathy Garcia-Molina,"Ronaldo Valdez, Aga Muhlach, Dingdong Dantes, Enrique Gil, Cristine Reyes, Donita Rose, Ketchup Eusebio, Kean Cipriano",Philippines,"March 14, 2019",2017,TV-MA,128 min,"Comedies, Dramas, International Movies","A dying father asks his busy and grown children to spend their Sundays with him, forcing his family to confront their issues before it's too late."
s5563,TV Show,Sherlock,,"Benedict Cumberbatch, Martin Freeman, Una Stubbs, Rupert Graves, Mark Gatiss, Andrew Scott","United Kingdom, United States","May 15, 2017",2017,TV-14,4 Seasons,"British TV Shows, Crime TV Shows, International TV Shows","In this updated take on Sir Arthur Conan Doyle's beloved mystery tales, the eccentric sleuth prowls the streets of modern London in search of clues."
s5567,Movie,Shimmer Lake,Oren Uziel,"Benjamin Walker, Rainn Wilson, Rob Corddry, Adam Pally, Ron Livingston, John Michael Higgins, Wyatt Russell, Stephanie Sigman, Mark Rendall, Isabel Dove, Angela Vint","Canada, United States","June 9, 2017",2017,TV-MA,87 min,"Dramas, Independent Movies, Thrillers","Unfolding in reverse time, this darkly comic crime thriller follows a local sheriff hunting three bank robbery suspects, one of whom is his brother."
s5578,Movie,Shopkins: World Vacation,Richard Bailey,"Kate Murphy, Cassandra Morris, Erika Harlacher, Abby Trott, Brianna Plantano, Reba Buhr, Doug Erholtz, Cherami Leigh, Brianna Knickerbocker",Australia,"November 15, 2018",2017,TV-Y,71 min,Movies,"The Shopkins and Shoppies jet around the world in search of missing friend Kooky Cookie, a stolen diamond and more vloggable adventure."
s5584,Movie,Shot Caller,Ric Roman Waugh,"Nikolaj Coster-Waldau, Omari Hardwick, Lake Bell, Jon Bernthal, Emory Cohen, Jeffrey Donovan, Evan Jones, Benjamin Bratt, Holt McCallany",United States,"November 24, 2019",2017,R,121 min,"Dramas, Thrillers","Trying to go straight, a once-successful businessman fresh out of prison is forced to orchestrate a brazen crime or risk his family."
s5585,TV Show,Shot in the Dark,,,United States,"November 17, 2017",2017,TV-MA,1 Season,Reality TV,"Three rival freelance stringers scour the streets at night to film crime scenes, fires, accidents – and anything else they can sell to news outlets."
s5590,Movie,Shubh Aarambh,Amit Barot,"Harsh Chhaya, Prachi Shah, Bharat Chawda, Deeksha Joshi, Aarjav Trivedi, Prashant Barot, Harsha Bhavsar",India,"March 1, 2018",2017,TV-PG,127 min,"Dramas, International Movies, Romantic Movies","As her own wedding looms on the horizon, a marriage counselor strives to save her future in-laws' crumbling relationship."
s5591,Movie,Shuddhi,Adarsh Eshwarappa,"Lauren Spartano, Niveditha, Amrutha Karagada, Shashank Purushotham, Sidhartha Maadhyamika, Ajay Raj, Sanchari Vijay, Veena Sundar","India, United States","March 1, 2018",2017,TV-14,115 min,"Dramas, International Movies, Thrillers",An American woman on a revenge mission travels to India and befriends two journalists seeking justice for violent crimes against women.
s5597,Movie,Sicilian Ghost Story,"Fabio Grassadonia, Antonio Piazza","Julia Jedlikowska, Gaetano Fernandez, Corinne Musallari, Lorenzo Curcio, Andrea Falzone, Federico Finocchiaro, Vincenzo Amato, Sabine Timoteo","Italy, France, Switzerland","July 6, 2019",2017,TV-MA,119 min,"Dramas, International Movies, Thrillers","When officials are slow to investigate a mysterious disappearance, a teen girl searches the dark woods on the outskirts of town for the boy she loves."
s5616,Movie,Simplemente Manu NNa,"Jan Suter, Raúl Campos",Manu NNa,Mexico,"May 5, 2017",2017,TV-MA,72 min,Stand-Up Comedy,Eclectic stand-up comic Manu NNa relays everyday tales about the struggles of being gay in Mexico and shares his love of telenovelas and mezcal.
s5633,Movie,Singularity,Robert Kouba,"Julian Schaffner, John Cusack, Jeannine Wacker, Carmen Argenziano, Eileen Grubba, Pavlo Bubryak","Switzerland, United States","June 1, 2018",2017,PG-13,92 min,"Action & Adventure, Dramas, Sci-Fi & Fantasy","Nearly a century after artificial intelligence tried to eradicate people from Earth, two survivors search for a human enclave rumored to still exist."
s5635,Movie,Sinister Circle,Dorian Fernández-Moris,"Milene Vázquez, Matías Raygada, Claudia Dammert, Marcello Rivera, Atilia Boschetti, Hernán Romero, Ismael Contreras, Pietro Sibille, Leslie Shaw",Peru,"October 1, 2019",2017,TV-MA,87 min,"Horror Movies, International Movies",A psychologist and her mute son confront evil forces at the site of a terrible tragedy involving an ancestral Ouija board and a demonic secret society.
s5651,Movie,Skins,Eduardo Casanova,"Ana Polvorosa, Candela Peña, Macarena Gómez, Carmen Machi, Jon Kortajarena, Secun de la Rosa, Itziar Castro, Antonio Durán 'Morris', Joaquín Climent, Ana María Ayala, Eloi Costa",Spain,"April 1, 2017",2017,TV-MA,78 min,"Dramas, International Movies","Deformed, disfigured characters must find a way to deal with society shunning their differences in this darkly comic social drama."
s5660,Movie,Slam,Andrea Molaioli,"Ludovico Tersigni, Jasmine Trinca, Luca Marinelli, Barbara Ramella, Gianluca Broccatelli, Pietro Ragusa, Fiorenza Tessari",Italy,"April 15, 2017",2017,TV-MA,99 min,"Comedies, Dramas, International Movies","Teen father-to-be Sam imagines his future as a young parent and finds a surprising mentor while reading about his idol, pro skateboarder Tony Hawk."
s5671,Movie,Slow Country,Eric Aghimien,"Ivie Okujaye, Sambasa Nzeribe, Tope Tedela, Gina Castel, Majid Michel, Victor Erabie, Brutus Richard, Adebayo Thomas",Nigeria,"December 6, 2019",2017,TV-MA,115 min,"Dramas, International Movies","Desperate to leave a life of prostitution, a teenage mother attempts to outsmart her ruthless boss who is determined to keep his prized asset."
s5673,Movie,Small Crimes,Evan Katz,"Nikolaj Coster-Waldau, Gary Cole, Molly Parker, Macon Blair, Pat Healy, Jacki Weaver, Robert Forster","Canada, United States","April 28, 2017",2017,TV-MA,95 min,"Dramas, Thrillers","After serving a six-year prison sentence, an ex-cop tries to rebuild his life in his hometown, but gets caught up in the fallout from his past."
s5675,Movie,Small Town Crime,"Ian Nelms, Eshom Nelms","John Hawkes, Anthony Anderson, Octavia Spencer, Robert Forster, Clifton Collins Jr., Jeremy Ratchford, James Lafferty, Michael Vartan, Daniel Sunjata, Don Harvey, Stefanie Scott, Caity Lotz, Dale Dickey",United States,"May 19, 2018",2017,R,92 min,Thrillers,"When a disgraced ex-cop discovers a dying woman, he's compelled to track down her killer – an act of self-redemption that takes him down a dark path."
s5677,Movie,Smash: Motorized Mayhem,,,United States,"May 15, 2017",2017,TV-MA,66 min,"Documentaries, Sports Movies","Buckle up for a look inside a biannual school bus race in Florida, a harrowing event where carnage and collisions are most definitely encouraged."
s5693,TV Show,Sofia the First,,"Ariel Winter, Darcy Rose Byrnes, Sara Ramirez, Tim Gunn, Coco Grayson, Travis Willingham, Wayne Brady, Jess Harnell, Meghan Strange, Zach Callison",United States,"October 8, 2018",2017,TV-Y,4 Seasons,Kids' TV,"When her commoner mother marries the king, average-girl Sofia finds that being a real princess isn't all it's cracked up to be."
s5703,Movie,Some Freaks,Ian MacAllister-McDonald,"Thomas Mann, Lily Mae Harrington, Ely Henry, Lachlan Buchanan, Marin Ireland, John Thorsen, Stephen Thorne, Shannon Hartman",United States,"December 18, 2017",2017,TV-MA,97 min,"Dramas, Romantic Movies","A one-eyed boy and plus-sized girl form a deep connection. But following a brief separation, they reunite as different people."
s5708,Movie,Something Huge,Carlo Padial,"Berto Romero, Carolina Bang, Javier Botet, Carlos Areces, Miguel Noguera, Toni Sevilla",Spain,"March 1, 2018",2017,TV-MA,87 min,"Comedies, Independent Movies, International Movies","A director and a comedian want to shoot the ""comedy of the future"" and make cinema history, but soon run out of resources and run into mission creep."
s5712,TV Show,Somewhere Between,,"Paula Patton, Devon Sawa, JR Bourne, Aria Birch, Catherine Barroll, Samantha Ferris, Imogen Tear, Daniel Bacon, Carmel Amit, Noel Johansen, Rebecca Staab",United States,"June 30, 2018",2017,TV-14,1 Season,"Crime TV Shows, TV Dramas, TV Mysteries","A local news producer is given one chance to relive a deadly week and stop a serial killer. If she fails, she'll lose her daughter forever."
s5722,TV Show,Sons of the Caliphate,,"Yakubu Mohammed, Paul Sambo, Mofe Duncan, Nita Byack George, Yvonne Hays, Mickey Odey, Rahama Sadau, Sani Muazu",Nigeria,"January 24, 2020",2017,TV-14,2 Seasons,"International TV Shows, TV Dramas","Three wealthy, power-hungry men tussle for sovereignty amid corrupt politics, passionate desires and family obligations."
s5740,Movie,Sparring,Samuel Jouy,"Mathieu Kassovitz, Olivia Merilahti, Souleymane M'Baye, Billie Blain, Malik Bine, Zakariya Gouram, Jolente De Keersmaeker, Lyes Salem, Ali Labidi, David Saracino",France,"September 1, 2018",2017,TV-MA,94 min,"Dramas, International Movies, Sports Movies",A middle-aged boxer with a mixed record becomes a champion's sparring partner while dreaming of one last chance to end his career with a victory.
