show_id,type,title,director,cast,country,date_added,release_year,rating,duration,listed_in,description
s2089,Movie,Face 2 Face,Matt Toronto,"Daniela Bobadilla, Daniel Amerman, Kevin McCorkle, Mary Gordon Murray, Emily Jordan, Karrie Cox, Nicholas James Reilly, Enspirit, Sheldon A. Smith, Michael Soulema",United States,"January 15, 2018",2017,TV-MA,89 min,"Dramas, Independent Movies","Two former friends, who now live far apart, learn about each other's insecurities and secrets over a series of video chats."
s2099,TV Show,Fallet,,"Lisa Henni, Adam Godley, Tomas von Brömssen, Lia Boysen, Christoffer Nordenrot, Stina Rautelin, Erik Madsen, Magnus Krepper, Meliz Karlge, Linda Nilarve, Björn Granath, Richenda Carey, Dag Malmberg",Sweden,"April 1, 2018",2017,TV-MA,1 Season,"Crime TV Shows, International TV Shows, TV Comedies",A Swedish detective and her timid British colleague's attempt to solve a gruesome murder case nets mixed results and miscommunication.
s2104,Movie,Familiye,"Sedat Kirtan, Kubilay Sarikaya","Kubilay Sarikaya, Arnel Taci, Muhammed Kirtan, Violetta Schurawlow, Burak Yiğit, Giwar Xatar Hajabi, Ridvan Kirtan, Ilhan Erdinc, Michael Hanemann, Sedat Kirtan",Germany,"May 1, 2019",2017,TV-MA,99 min,"Dramas, Independent Movies, International Movies","An ex-con struggles to take care of his two brothers, a gambling addict and a young man with Down syndrome, after being released from prison."
s2111,Movie,Fanatyk,Michał Tylka,"Piotr Cyrwus, Mikołaj Kubacki, Anna Radwan, Marian Dziędziel, Jan Nowicki, Juliusz Chrząstowski, Małgorzata Krzysica, Jacek Strama",Poland,"February 14, 2020",2017,TV-MA,33 min,"Comedies, Dramas, Independent Movies","As a son deals with his own struggles, he must calm his father's obsession with fishing before his outlandish behavior ruins the entire family."
s2116,Movie,Farce,Shadi Ali,"Ahmed Fathy, Bayoumi Fouad, Sami Maghouri, Mohammed Tharwat, Mohamed Salam, Haya Ibrahim, Mohsen Mansour",Egypt,"June 6, 2019",2017,TV-MA,94 min,"Comedies, International Movies","A beauty expert, a drug dealer and a bungling revolutionary end up in the grips of an extremist group after meeting on a plane to Lebanon."
s2126,TV Show,Fate/Apocrypha,,"Natsuki Hanae, Maaya Sakamoto, Kouki Uchiyama, Miyuki Sawashiro, Saori Hayami, Koji Yusa, Makoto Furukawa, Tetsu Inada, Satoshi Tsuruoka, Kei Shindou, Junichi Suwabe, Shunsuke Takeuchi, Ryotaro Okiayu, Mitsuru Miyamoto, Rumi Okubo, Ai Nonaka, Sakura Tange",Japan,"November 7, 2017",2017,TV-MA,2 Seasons,"Anime Series, International TV Shows",The theft of the Greater Grail from Fuyuki City leads to a splintered timeline in which the Great Holy Grail War is waged on an unprecedented scale.
s2131,TV Show,Father Brown,Ian Barber,"Mark Williams, Sorcha Cusack, Nancy Carroll, Alex Price, Hugo Speer, Tom Chambers, Keith Osborn",United Kingdom," March 31, 2018",2017,TV-14,6 Seasons,"British TV Shows, Crime TV Shows, TV Dramas","A modest, compassionate priest doubles as an effective crime solver in this series based on the short stories by G.K. Chesterton."
s2141,Movie,Feel Rich,Peter Spirer,"Quincy Jones, Common, Russell Simmons, Fat Joe, Paul Wall, Quincy Jones III",United States,"August 23, 2017",2017,TV-MA,70 min,Documentaries,"Talking squarely to the hip-hop generation, musicians, athletes and others outline the benefits of exercise, a healthy diet and spiritual wellness."
s2145,Movie,Felipe Neto: My Life Makes No Sense,Diego Pignataro,Felipe Neto,Brazil,"March 24, 2017",2017,TV-MA,91 min,Stand-Up Comedy,"YouTube sensation Felipe Neto brings the stories from his autobiographical book ""Não Faz Sentido!"" to the stage in this comedy special."
s2162,Movie,Filmworker,Tony Zierra,Leon Vitali,United States,"November 1, 2018",2017,TV-MA,94 min,Documentaries,Leon Vitali had a thriving acting career most others would envy. Then he gave it all up to devote himself completely to the vision of Stanley Kubrick.
s2167,TV Show,FINAL FANTASY XIV Dad of Light,,"Yudai Chiba, Ren Osugi, Fumika Baba, Yoshihiko Hakamada, Hatsunori Hasegawa, Mako Ishino",Japan,"September 1, 2017",2017,TV-PG,1 Season,"International TV Shows, TV Dramas",A father and son rekindle their bond through the online role-playing game Final Fantasy XIV in this live-action series based on a true story.
s2168,Movie,Finally Found Someone,Theodore Boborol,"John Lloyd Cruz, Sarah Geronimo, Enchong Dee, Christian Bables, Joey Marquez, Yayo Aguila, Tetchie Agbayani, Dennis Padilla, Leo Rialp, Alwyn Uytingco",Philippines,"March 14, 2019",2017,TV-14,125 min,"International Movies, Romantic Movies","After a woman is very publicly left at the altar, the PR expert hired to fix the situation winds up falling in love with her."
s2172,TV Show,Fire Chasers,,,United States,"September 8, 2017",2017,TV-MA,1 Season,"Docuseries, Science & Nature TV","As California's 2016 fire season rages, brave backcountry firefighters race to put out the flames, protect homes and save lives in this docuseries."
s2180,Movie,Fireworks,"Akiyuki Shinbo, Nobuyuki Takeuchi","Yuki Kaji, Nobuo Tobita, Michiko Neya, Mitsuru Miyamoto, Fumihiko Tachiki, Shintaro Asanuma, Takahiro Sakurai, Kana Hanazawa, Toshiyuki Toyonaga, Suzu Hirose, Shinichiro Miki, Mamoru Miyano, Takako Matsu, Masaki Suda",Japan,"December 25, 2019",2017,TV-PG,91 min,"Anime Features, Romantic Movies","Middle schooler Nazuna desperately wants to run away with her classmate Norimichi, who somehow turns back time on this fateful summer's day."
s2183,Movie,First Kill,Steven C. Miller,"Hayden Christensen, Bruce Willis, Gethin Anthony, Megan Leonard, Tyler Jon Olson, Shea Buckner, William DeMeo, Magi Avila, Ty Shelton, Christine Dye","United Kingdom, Canada, United States","September 1, 2019",2017,R,102 min,Action & Adventure,"A stock broker brings his young son back to the town where he grew up for a hunting trip, but things take a dangerous turn when they witness a crime."
s2188,Movie,First They Killed My Father,Angelina Jolie,"Sreymoch Sareum, Kompheak Phoeung, Socheata Sveng, Dara Heng, Sothea Khoun, Sreyneang Oun, Kimhak Mun, Chenda Run, Nika Sarun, Nita Sarun","Cambodia, United States","September 15, 2017",2017,TV-MA,137 min,Dramas,A 5-year-old girl embarks on a harrowing quest for survival amid the sudden rise and terrifying reign of the Khmer Rouge in Cambodia.
s2191,Movie,Fishpeople,Keith Malloy,,,"April 1, 2018",2017,TV-14,49 min,"Documentaries, Sports Movies","In this exploration of the life-changing power of the ocean, six people from very different backgrounds find purpose and meaning in the sea."
s2197,TV Show,Five Came Back,Laurent Bouzereau,"Steven Spielberg, Guillermo del Toro, Lawrence Kasdan, Francis Ford Coppola, Paul Greengrass, Meryl Streep",United States,"March 31, 2017",2017,TV-MA,1 Season,Docuseries,Five acclaimed contemporary directors tell the story of five legendary Hollywood filmmakers who enlisted in the armed forces to document World War II.
s2202,TV Show,Flaked,,"Will Arnett, David Sullivan, Ruth Kearney, George Basil, Lina Esco, Travis Mills, Robert Wisdom, Mark Boone Junior, Matthew Willig, Heather Graham, Kirstie Alley, Sab Shimono, Christopher Mintz-Plasse, Minerva Garcia, Jeff Daniel Phillips",United States,"June 2, 2017",2017,TV-MA,2 Seasons,"TV Comedies, TV Dramas","In his funky California beach enclave, Chip's the go-to guy for personal insights. But he isn't quite as enlightened when it comes to his own baggage."
s2214,Movie,Follow Me,Asri Bendacha,Asri Bendacha,"United Arab Emirates, United States, United Kingdom","November 16, 2018",2017,TV-MA,86 min,"Documentaries, International Movies","Aspiring to be an internet celebrity and make big bucks, a filmmaker travels the world to learn the tricks of the trade from social media influencers."
s2217,Movie,Food on the Go,Mercedes Cordova,,"Argentina, Italy","May 16, 2018",2017,TV-MA,66 min,"Documentaries, International Movies","Epicureans and experts trace the migration of Italian cuisine and its evolution in the Americas, delving into the ideas of origin, diaspora and heritage."
s2219,TV Show,Food: Delicious Science,,"Michael Mosley, James Wong",,"October 1, 2017",2017,TV-PG,1 Season,"Docuseries, Science & Nature TV","In this series, TV presenter Michael Mosley and botanist James Wong explore the physics, chemistry and biology inside every bite of food we eat."
s2231,TV Show,For the Win,,Brodie Smith,United States,"December 31, 2018",2017,TV-14,1 Season,Reality TV,Frisbee national champion Brodie Smith challenges inventive athletes across the US to an exhibition match in the unconventional sports they've created.
s2232,Movie,For Your Own Good,Carlos Therón,"Jose Coronado, Javier Cámara, Roberto Álamo, Pilar Castro, María Pujalte, Carmen Ruiz, Silvia Alonso, Georgina Amorós, Andrea Ros, Miki Esparbé",Spain,"October 1, 2017",2017,TV-MA,93 min,"Comedies, International Movies","Three brothers-in-law join forces to secretly drive away their daughters' undesirable boyfriends: anarchist Álex, bad-boy Dani and playboy Ernesto."
s2233,Movie,Forbidden Games: The Justin Fashanu Story,"Jon Carey, Adam Darke","Justin Fashanu, John Fashanu",United Kingdom,"December 1, 2017",2017,TV-14,81 min,"Documentaries, International Movies, LGBTQ Movies","This documentary chronicles the tragic, true story of Justin Fashanu, the first – and only – openly gay man to have played professional soccer."
s2245,Movie,Forgotten,Hang-Jun Jang,"Ha-neul Kang, Moo-Yul Kim, Young-hee Na, Seong-kun Mun, Myung-Ryul Nam, Eun-woo Lee, Chan-bi Jung, Go Choi, Seong-il Bae, Soon-won Lee",South Korea,"February 21, 2018",2017,TV-MA,109 min,"Dramas, International Movies, Thrillers","When his abducted brother returns seemingly a different man with no memory of the past 19 days, Jin-seok chases after the truth behind the kidnapping."
s2265,Movie,Frat Star,"Grant S. Johnson, Ippsie Jones","Connor Lawrence, Justin Mark, Cathryn Dylan, Chris Elliott, Tyler Weaks, Max Sheldon, Austin Ramsey, Peter O'Connor, Nicole Balsam, Kaitlin Mesh",United States,"April 10, 2017",2017,TV-MA,85 min,Comedies,A freshman uninterested in joining a fraternity is convinced to pledge by a rich roommate who introduces him to a world darker than he ever dreamed.
s2286,TV Show,Friday Night Tykes,,,United States," January 17, 2018",2017,TV-PG,4 Seasons,"Docuseries, Reality TV","This docuseries dives into the cutthroat world of Texas youth football, where kids face grueling demands and pressure from coaches and parents to win."
s2294,Movie,From Japan to Egypt,Mahmoud Karim,"Ahmed Eid, Saki Tsukamoto, Nada Moussa, Mohammed Tharwat",Egypt,"June 6, 2019",2017,TV-14,93 min,"Children & Family Movies, Comedies, Dramas","After his wife relocates to her home country of Japan, an Egyptian man – and father of two rambunctious kids – tries to win her back."
s2313,Movie,FullMetal Alchemist,Fumihiko Sori,"Ryosuke Yamada, Tsubasa Honda, Dean Fujioka, Misako Renbutsu, Kanata Hongo, Shinji Uchiyama, Jun Kunimura, Yo Oizumi, Ryuta Sato, Fumiyo Kohinata, Yasuko Matsuyuki",Japan,"February 19, 2018",2017,TV-PG,134 min,"Action & Adventure, Dramas, International Movies","While alchemist Edward Elric searches for a way to restore his brother Al's body, the military government and mysterious monsters are watching closely."
s2315,Movie,Fun Mom Dinner,Alethea Jones,"Katie Aselton, Toni Collette, Bridget Everett, Molly Shannon, Adam Scott, Rob Huebel, Adam Levine, Paul Rust",United States,"December 31, 2017",2017,R,82 min,"Comedies, International Movies","Four preschool moms with little in common need a night out to take a break from their kids. But one thing leads to another, and things get rowdy."
s2320,Movie,Furthest Witness,Adam Del Giudice,"Aaron Stanford, Teri Reeves, Sean Patrick Flanery, Forrest Fyre, Steven Michael Quezada, Paul Blott, Travis Hammer, Ryan Begay, Jermaine Washington, Vincent McDaniel","United States, United Kingdom","April 24, 2019",2017,TV-MA,88 min,"Dramas, Thrillers","Kyle helps people disappear, but when a crazed killer starts hunting down his latest client, he has to decide what he's willing to do to keep her safe."
s2323,Movie,İstanbul Kırmızısı,Ferzan Özpetek,"Halit Ergenç, Nejat İşler, Mehmet Günsür, Çiğdem Selışık Onat, Tuba Büyüküstün, Serra Yılmaz, Zerrin Tekindor, Ayten Gökçer, İpek Bilgin, Ergin Bal","Italy, Turkey","April 28, 2020",2017,TV-MA,110 min,"Dramas, Independent Movies, International Movies","Upon his return to Istanbul, an expat writer-editor finds himself stranded inside a web of tangled relationships after his filmmaker friend vanishes."
s2330,Movie,Gabriel and the Mountain,Fellipe Barbosa,"João Pedro Zappa, Caroline Abras, Alex Alembe, Leonard Siampala, Tony B. Lesika, John Goodluck, Rashidi Athuman, Toney Montana, George Ngandu, Rhosinah Sekeleti, Luke Mpata, Lewis Gadson, Manuela Pacq","Brazil, France","November 9, 2018",2017,TV-MA,132 min,"Dramas, Independent Movies, International Movies","In a drama based on a true story, Brazilian backpacker Gabriel Buchmann spends his gap year exploring Africa. Why does he die in the Malawi mountains?"
s2334,Movie,Gad Gone Wild,Mario Rouleau,Gad Elmaleh,France,"January 23, 2017",2017,TV-MA,57 min,Stand-Up Comedy,French comic Gad Elmaleh regales a Montreal crowd with tales of awkward mix-ups and baffling customs he's encountered since moving to the U.S.
s2336,Movie,Gaga: Five Foot Two,Chris Moukarbel,Lady Gaga,United States,"September 22, 2017",2017,TV-MA,101 min,"Documentaries, Music & Musicals","Follow pop provocateur Lady Gaga as she releases a new album, preps for her Super Bowl halftime show, and confronts physical and emotional struggles."
s2339,Movie,Galih dan Ratna,Lucky Kuswandi,"Refal Hady, Sheryl Sheinafia, Ayu Dyah Pasha, Joko Anwar, Hengky Tarnando, Marissa Anita, Sari Koeswoyo",Indonesia,"September 15, 2018",2017,TV-PG,111 min,"Dramas, International Movies, Romantic Movies",Sparks fly between the new girl at school and the misfit with a passion for music. Yet the world threatens to put a stop to their innocent love song.
s2370,Movie,Gender Revolution: A Journey with Katie Couric,,Katie Couric,United States,"February 1, 2018",2017,TV-PG,90 min,"Documentaries, LGBTQ Movies","Katie Couric explores our evolving understanding of gender identity, speaking with transgender and intersex individuals about their experiences."
s2371,Movie,Generation Iron 2,Vlad Yudin,,United States,"October 1, 2017",2017,PG-13,107 min,"Documentaries, Sports Movies","New-generation bodybuilding stars – including Rich Piana, Kai Greene and Calum von Moger – share their experiences competing in the demanding sport."
s2380,Movie,Gerald's Game,Mike Flanagan,"Carla Gugino, Bruce Greenwood, Henry Thomas, Carel Struycken, Chiara Aurelia",United States,"September 29, 2017",2017,TV-MA,103 min,"Horror Movies, Thrillers","When her husband's sex game goes wrong, Jessie – handcuffed to a bed in a remote lake house – faces warped visions, dark secrets and a dire choice."
s2385,Movie,Get Me Roger Stone,"Dylan Bank, Daniel DiMauro, Morgan Pehme",Roger Stone,United States,"May 12, 2017",2017,TV-MA,101 min,Documentaries,"Examine the rise, fall and rebirth of political operative Roger Stone, who's been an influential member of Team Trump for decades."
s2388,TV Show,Get Shorty,,"Ray Romano, Chris O'Dowd",United States,"November 1, 2018",2017,TV-MA,1 Season,"Crime TV Shows, TV Comedies, TV Dramas",Organized crime enforcer Miles Daly strives to reinvent himself as a Hollywood filmmaker in this satire based on Elmore Leonard's best-selling novel.
s2395,Movie,Ghost House,Rich Ragsdale,"Scout Taylor-Compton, James Landry Hébert, Mark Boone Junior, Michael S. New, Russell Geoffrey Banks, Rich Lee Gray, Elana Krausz, Kevin Ragsdale, Wen-Chu Yang, Katrina Grey","Thailand, United States","December 31, 2017",2017,TV-MA,100 min,Horror Movies,"While visiting the site of a supernatural shrine in the Thai countryside, a vacationing couple unwittingly upsets a vengeful demon."
s2397,Movie,Ghost of the Mountains,Ben Wallis,Antoine Fuqua,United States,"September 13, 2017",2017,G,78 min,Documentaries,An international group of filmmakers sets out on a mission to get up close and personal with a family of elusive snow leopards.
s2426,TV Show,Girlboss,,"Britt Robertson, Ellie Reed, Johnny Simmons, Alphonso Mcauley",United States,"April 21, 2017",2017,TV-MA,1 Season,TV Comedies,"Rebellious and broke, Sophia stumbles into creating an online business and learns how to be the boss. A comedy inspired by the best-selling memoir."
s2427,Movie,Girlfriend's Day,Michael Paul Stephenson,"Bob Odenkirk, Amber Tamblyn, Natasha Lyonne, Alex Karpovsky, Stacy Keach, Andy Richter, Ed Begley Jr., David Sullivan, Larry Fessenden, June Diane Raphael, Rich Sommer, Steven Michael Quezada, Echo Kellum, Stephanie Courtney, Toby Huss, Tucker Smallwood, Kevin O'Grady, Nate Mooney",United States,"February 14, 2017",2017,TV-MA,71 min,"Comedies, Independent Movies","When he's caught up in a deadly conspiracy, an unemployed greeting card writer must create the perfect card for a new holiday to save his skin."
s2440,TV Show,Glitter Force Doki Doki,Go Koga,"Debi Derryberry, Cassandra Morris, Melissa Fahn, Stephanie Sheh, Erica Lindbeck, Kate Higgins, Cherami Leigh, Tara Sands, Bryce Papenbrook, Erica Mendez, Ray Chase, Carrie Keranen, Ben Diskin, Grant George, Kirk Thornton",Japan,"November 10, 2017",2017,TV-Y7,2 Seasons,"Anime Series, Kids' TV",Four girls summon their inner superheroes to defend Earth and the magical kingdom of Splendorius from King Mercenare and his minions.
s2454,Movie,God of War,Gordon Chan,"Vincent Zhao, Sammo Kam-Bo Hung, Regina Wan, Yasuaki Kurata, Keisuke Koide, Timmy Hung, Michael Tong","China, Hong Kong","December 16, 2017",2017,NR,129 min,"Action & Adventure, International Movies",A maverick leader and a clever young general take on Japanese pirates amid bureaucratic intrigue in Ming Dynasty China.
s2457,Movie,God's Own Country,Francis Lee,"Josh O'Connor, Alec Secareanu, Ian Hart, Gemma Jones",United Kingdom,"May 1, 2018",2017,TV-MA,105 min,"Dramas, Independent Movies, International Movies","In Yorkshire, a withdrawn gay farmer begins a torrid affair with a Romanian migrant worker who shows him the depths of his capacity for affection."
s2458,TV Show,Godless,,"Jeff Daniels, Michelle Dockery, Jack O'Connell, Scoot McNairy, Merritt Wever, Thomas Brodie-Sangster, Sam Waterston, Tantoo Cardinal",United States,"November 22, 2017",2017,TV-MA,1 Season,TV Dramas,"A ruthless outlaw terrorizes the West in search of a former member of his gang, who’s found a new life in a quiet town populated only by women."
s2459,TV Show,Godzilla,"Kobun Shizuno, Hiroyuki Seshita","Mamoru Miyano, Takahiro Sakurai, Kana Hanazawa, Tomokazu Sugita, Yuki Kaji, Junichi Suwabe, Daisuke Ono, Kenta Miyake, Kenyu Horiuchi, Kazuya Nakai, Kazuhiro Yamaji",Japan,"January 17, 2018",2017,TV-14,1 Season,TV Shows,"A desperate group of refugees attempts to recolonize Earth 20,000 years after Godzilla took over. But one young man wants revenge above all else."
s2468,TV Show,Goldie & Bear,,"Natalie Lander, Georgie Kidder",United States," October 31, 2018",2017,TV-Y,2 Seasons,Kids' TV,"Best pals Goldie and Bear, from ""Goldilocks and the Three Bears,"" join other characters from beloved stories for adventures in the Fairy Tale Forest."
s2476,Movie,Good and Prosperous,Sameh Abdulaziz,"Ali Rabee, Mohamed Abdel-Rahman, Bayoumi Fouad, Karim Afifi, Dalal Abdel Aziz, Mai Selim, Tara Emad, Mohammed Tharwat, Haifa Wehbe, Ahmed Adel",Egypt,"December 10, 2019",2017,TV-14,101 min,"Comedies, International Movies","As two jobless brothers search aimlessly for careers worthy of their hard-to-please mother’s praise, they cluelessly tackle countless gigs."
s2486,TV Show,Good Morning Call,,"Haruka Fukuhara, Shunya Shiraishi, Dori Sakurada, Moe Arai, Kentaro, Shugo Nagashima, Koya Nagasawa, Hinako Tanaka, Tomoharu Hasegawa, Tomoko Fujita, Erika Mori, Kei Tanaka, Yosuke Sugino, Maryjun Takahashi, Itsuki Sagara, Madoka Yoshida",Japan,"November 28, 2017",2017,TV-14,2 Seasons,"International TV Shows, Romantic TV Shows, TV Comedies","A high school girl finally gets her own apartment, but she has to share it with the most popular boy in school. No one can know they're living together."
s2491,Movie,Good Time,"Benny Safdie, Josh Safdie","Robert Pattinson, Benny Safdie, Jennifer Jason Leigh, Barkhad Abdi, Buddy Duress, Peter Verby, Taliah Webster, Necro",United States,"February 11, 2020",2017,R,101 min,"Dramas, Independent Movies, Thrillers","After spearheading an ill-fated bank robbery, a man must get his mentally challenged younger brother out of jail while eluding his own capture."
s2496,Movie,Gook,Justin Chon,"Simone Baker, Justin Chon, David So, Curtiss Cook Jr., Sang Chon, Ben Munoz, Omono Okojie, Isaiah Jarel",United States,"March 6, 2018",2017,TV-MA,95 min,"Dramas, Independent Movies","Amidst the looting and chaos of the LA riots, two Korean-American brothers fight to save their struggling shoe store while contemplating their future."
s2512,TV Show,GRANBLUE FANTASY the Animation,,"Yuki Ono, Nao Toyama, Rie Kugimiya, Miyuki Sawashiro, Hiroaki Hirata, Yukari Tamura, Kazuhiro Yamaji, Rie Tanaka, Emiri Kato, Tomokazu Sugita, Kanae Ito",Japan,"July 15, 2019",2017,TV-PG,1 Season,"Anime Series, International TV Shows","In a world where islands float in the sky, Gran encounters a mysterious girl wanted by the Erste Empire for her ability to summon Primal Beasts."
s2514,TV Show,Grand Designs,,Kevin McCloud,United Kingdom,"August 1, 2019",2017,TV-14,2 Seasons,"British TV Shows, International TV Shows, Reality TV","Host Kevin McCloud presents people who take self-building houses to a new level, following every step of their ambitious plans from beginning to end."
s2521,Movie,Grass,Tanuj Chopra,"Emily Chang, Pia Shah, Anthony Ma",United States,"February 14, 2019",2017,TV-MA,57 min,"Comedies, Independent Movies",Good girl Cam recruits her pot-loving bestie Jinky to help deliver a backpack full of weed for her drug-dealing fiancé.
s2525,TV Show,Great News,,"Briga Heelan, Andrea Martin, Adam Campbell, John Michael Higgins, Horatio Sanz, Nicole Richie",United States,"October 25, 2018",2017,TV-14,2 Seasons,TV Comedies,A TV news producer's ambitions take an awkward turn when her mother rejoins the workforce and snags a job as the station's newest intern.
s2527,TV Show,Great Yellowstone Thaw,,,United Kingdom,"October 1, 2017",2017,TV-PG,1 Season,"Docuseries, Science & Nature TV",This series explores the effects of the extreme temperature variations at Yellowstone National Park on the animals that live there.
s2541,Movie,Grillo vs Grillo,,Beppe Grillo,Italy,"February 10, 2017",2017,TV-MA,96 min,Stand-Up Comedy,"Outspoken comedian Beppe Grillo reminisces about his long career, including the triumphs and controversies that fueled his rise in Italian politics."
s2557,Movie,Gurgaon,Shanker Raman,"Akshay Oberoi, Pankaj Tripathi, Aamir Bashir, Ragini Khanna, Shalini Vatsa",India,"May 1, 2018",2017,TV-14,106 min,"Dramas, International Movies, Thrillers","When the daughter of a wealthy family returns from college, she gets a frosty welcome from her brother, who has problems – and plans – of his own."
s2563,TV Show,Gypsy,,"Naomi Watts, Billy Crudup, Sophie Cookson, Karl Glusman, Poorna Jagannathan, Brooke Bloom, Lucy Boynton, Melanie Liburd, Brenda Vaccaro, Maren Heary, Blythe Danner","United States, United Kingdom","June 30, 2017",2017,TV-MA,1 Season,TV Dramas,Therapist Jean Holloway develops dangerous and intimate relationships with the people in her patients' lives in this simmering psychological thriller.
s2582,Movie,Hakkunde,Oluseyi Asurf,"Frank Donga, Rahama Sadau, Ali Nuhu, Toyin Aimakhu, Tunbosun Aiyedehin, Maryam Booth, Ahaji Issa Bello, Adebukola, Bukky Ajayi, Ibrahim Daddy, Seyilaw, Tomiwa Kukoyi",Nigeria,"January 31, 2020",2017,TV-14,93 min,"Comedies, Dramas, Independent Movies",A perpetually unemployed graduate desperately leaves his city for a potential opportunity until a roadblock threatens to derail his chance at a career.
s2584,Movie,Half Girlfriend,Mohit Suri,"Arjun Kapoor, Shraddha Kapoor, Vikrant Massey, Seema Biswas, Rhea Chakraborty, Sujata Sehgal, Anisa Butt",India,"January 2, 2020",2017,TV-14,129 min,"Dramas, International Movies, Romantic Movies","Small-town Madhav falls for big-city Riya and wants her to be his girlfriend. But she views their relationship differently, and suggests a compromise."
s2588,TV Show,Halt and Catch Fire,,"Lee Pace, Scoot McNairy, Mackenzie Davis, Kerry Bishé, Toby Huss, Aleksa Palladino, David Wilson Barnes, Morgan Hinkleman, James Cromwell, Manish Dayal, Annabeth Gish",United States,"December 14, 2017",2017,TV-14,4 Seasons,TV Dramas,"Re-creating the dawn of the personal computer era, this digital drama tracks the fates of an industry visionary and his brilliant colleagues."
s2592,Movie,Hamza's Suitcase,Akram Farouk,"Hamada Helal, Yousra El Lozy, Ahmed Fathy, Mohammed Tharwat, Samia Trabelsi, Diaa El-Merghani, Abdalah Mishrif, Mohamed Metwalli, Samy Maghawry, Bayoumi Fouad, Inas al-Najjar, Taher Abu Lela",Egypt,"May 2, 2019",2017,TV-14,79 min,"Comedies, International Movies","When a con man tries to retrieve a bag of money, he swoons for a woman with ties to a notorious crew of criminals."
s2595,Movie,Handsome: A Netflix Mystery Movie,Jeff Garlin,"Jeff Garlin, Natasha Lyonne, Amy Sedaris, Steven Weber, Christine Woods, Eddie Pepitone, Timm Sharp, Brad Morris, Leah Remini, Ava Acres",United States,"May 5, 2017",2017,TV-MA,81 min,Comedies,Homicide detective Gene Handsome sets out to solve a woman's murder while searching for clues about what's missing from his personal life.
