show_id,type,title,director,cast,country,date_added,release_year,rating,duration,listed_in,description
s11,Movie,1922,Zak Hilditch,"Thomas Jane, Molly Parker, Dylan Schmid, Kaitlyn Bernard, Bob Frazer, Brian d'Arcy James, Neal McDonough",United States,"October 20, 2017",2017,TV-MA,103 min,"Dramas, Thrillers","A farmer pens a confession admitting to his wife's murder, but her death is just the beginning of a macabre tale. Based on Stephen King's novella."
s20,Movie,'89,,"Lee Dixon, Ian Wright, Paul Merson",United Kingdom,"May 16, 2018",2017,TV-PG,87 min,Sports Movies,"Mixing old footage with interviews, this is the story of Arsenal's improbable win versus Liverpool in the final moments of the 1989 championship game."
s23,Movie,​Maj Rati ​​Keteki,Santwana Bardoloi,"Adil Hussain, Shakil Imtiaz, Mahendra Rabha, Sulakshana Baruah, Rahul Gautam Sarma, Kulada Bhattacharjya, Indu Mohan Das, Moumita Talukdar",India,"September 15, 2018",2017,TV-14,117 min,"Dramas, International Movies","A successful writer returns to the town that launched his career, encountering people who spark nostalgic, often painfully illuminating flashbacks."
s24,Movie,​Mayurakshi,Atanu Ghosh,"Soumitra Chatterjee, Prasenjit Chatterjee, Indrani Haldar, Sudipta Chakraborty, Suman Banerjee, Gargi Roychowdhury",India,"September 15, 2018",2017,TV-14,100 min,"Dramas, International Movies","When a middle-aged divorcee returns to Kolkata to visit his ailing father, long-buried memories resurface, bringing new discoveries with them."
s34,Movie,#realityhigh,Fernando Lebrija,"Nesta Cooper, Kate Walsh, John Michael Higgins, Keith Powers, Alicia Sanz, Jake Borelli, Kid Ink, Yousef Erakat, Rebekah Graf, Anne Winters, Peter Gilroy, Patrick Davis",United States,"September 8, 2017",2017,TV-14,99 min,Comedies,"When nerdy high schooler Dani finally attracts the interest of her longtime crush, she lands in the cross hairs of his ex, a social media celebrity."
s42,Movie,Ég man þig,Óskar Thór Axelsson,"Jóhannes Haukur Jóhannesson, Ágústa Eva Erlendsdóttir, Elma Stefania Agustsdottir, Thor Kristjansson, Anna Gunndís Guðmundsdóttir, Sara Dögg Ásgeirsdóttir, Þröstur Leó Gunnarsson, Jóhann Sigurðarson, Sveinn Geirsson, Arnar Páll Harðarson",Iceland,"March 27, 2018",2017,TV-MA,106 min,"Horror Movies, International Movies","Young urbanites renovating a rundown house, and a psychiatrist grieving his son's disappearance, are connected to a supernatural, decades-old secret."
s48,Movie,1 Mile to You,Leif Tilden,"Billy Crudup, Graham Rogers, Liana Liberato, Stefanie Scott, Tim Roth, Melanie Lynskey, Thomas Cocquerel, Peter Coyote",United States,"July 7, 2017",2017,TV-14,105 min,"Dramas, Romantic Movies, Sports Movies","After escaping the bus accident that killed his girlfriend, a high school student channels his grief into running, with the help of a new coach."
s49,Movie,10 Days in Sun City,Adze Ugah,"Ayo Makun, Adesua Etomi, Richard Mofe-Damijo, Mercy Johnson, Falz, Tuface Idibia, Thenjiwe Moseley, Motlatsi Mafatshe, Celeste Ntuli, Miguel A. Núñez Jr.","South Africa, Nigeria","October 18, 2019",2017,TV-14,87 min,"Comedies, International Movies, Romantic Movies","After his girlfriend wins the Miss Nigeria pageant, a young man faces unexpected competition of his own when he joins her on a campaign in South Africa."
s59,TV Show,100% Hotter,,"Daniel Palmer, Melissa Sophia, Karen Williams, Grace Woodward",United Kingdom,"November 1, 2019",2017,TV-14,1 Season,"British TV Shows, International TV Shows, Reality TV","A stylist, a hair designer and a makeup artist team up to give Britain's biggest fashion disasters some much-needed makeunders."
s61,Movie,12 ROUND GUN,Sam Upton,"Sam Upton, Jared Abrahamson, Mark Boone Junior, Laila Ali, Kate Vernon, Cassi Thomson, Colby French, Miguel Perez, Jay Acovone",United States,"March 14, 2019",2017,TV-MA,90 min,"Dramas, Independent Movies, Sports Movies","Dealing with personal demons and the death of his son, a prizefighter attempts a return to the ring by challenging his rival to a 12-round rematch."
s68,Movie,13TH: A Conversation with Oprah Winfrey & Ava DuVernay,,"Oprah Winfrey, Ava DuVernay",,"January 26, 2017",2017,,37 min,Movies,"Oprah Winfrey sits down with director Ava DuVernay to discuss her Oscar-nominated film, historical cycles of oppression and the broken prison system."
s88,TV Show,21 Thunder,,"Stephanie Bennett, Emmanuel Kabongo, RJ Fetherstonhaugh, Andres Joseph, Kevin Claydon, Conrad Pla, Clark Backo, Ryan Pierce, Eileen Li, Susan Bain, Cristina Rosato, Jonathan Kim, Colm Feore",Canada,"March 1, 2018",2017,TV-MA,1 Season,"Crime TV Shows, International TV Shows, TV Dramas","Players and coaches for a Montreal soccer team chase dreams of stardom while their personal lives erupt with love, fear, passion and violence."
s90,Movie,24 Hours to Live,Brian Smrz,"Ethan Hawke, Xu Qing, Paul Anderson, Rutger Hauer, Tyrone Keogh, Nathalie Boltt, Liam Cunningham","South Africa, China, United States","April 7, 2018",2017,R,93 min,Action & Adventure,"Revived by an experimental procedure, a hit man gets to live an extra 24 hours – which he uses to avenge his dead wife and child and redeem himself."
s94,Movie,27: Gone Too Soon,Simon Napier-Bell,"Janis Joplin, Jimi Hendrix, Amy Winehouse, Jim Morrison, Kurt Cobain",United Kingdom,"May 1, 2018",2017,TV-MA,70 min,Documentaries,"Explore the circumstances surrounding the tragic deaths at 27 of Jimi Hendrix, Jim Morrison, Brian Jones, Janis Joplin, Kurt Cobain and Amy Winehouse."
s111,Movie,42 Grams,Jack C. Newell,Jake Bickelhaupt,United States,"February 1, 2018",2017,TV-MA,81 min,Documentaries,"After launching a successful underground restaurant out of their apartment, an ambitious chef and his wife open an all-consuming upscale eatery."
s114,Movie,48 Christmas Wishes,"Marco Deufemia, Justin G. Dyck","Khiyla Aynne, Noah Dyer, Maya Franzoi, Clara Kushnir, Madeline Leon, Liam MacDonald, Matt Schichter, Ethan Yang, Adam Crew",Canada,"December 20, 2017",2017,TV-G,84 min,"Children & Family Movies, Comedies","When a small town's letters to Santa accidentally go up in smoke, two elves venture out of the North Pole to retrieve every missing wish."
s118,Movie,5 Cowok Jagoan,Anggy Umbara,"Ario Bayu, Arifin Putra, Dwi Sasono, Muhadkly Acho, Cornelio Sunny, Tika Bravani, Nirina Zubir, Ganindra Bimo, Verdi Solaiman",,"January 5, 2019",2017,TV-MA,106 min,"Action & Adventure, Comedies, International Movies",Yanto asks his friends to help save a girlfriend who was kidnapped by a mobster. Silly slapstick and campy crimefighting ensues.
s127,Movie,6 Days,Toa Fraser,"Jamie Bell, Abbie Cornish, Mark Strong, Martin Shaw, Ben Turner, Aymen Hamdouchi, Tim Pigott-Smith, Robert Portal, Colin Garlick, Andrew Grainger, Martin Hancock, Emun Elliott","New Zealand, United Kingdom","February 8, 2018",2017,R,94 min,"Action & Adventure, Dramas, International Movies","When armed gunmen seize the Iranian Embassy in 1980, a tense six-day standoff ensues while elite British soldiers prepare for a dangerous raid."
s132,Movie,68 Kill,Trent Haaga,"Matthew Gray Gubler, AnnaLynne McCord, Alisha Boe, Sheila Vand, Sam Eidson, James Moses Black, Ajay Mehta, Michael Beasley, David Maldonado, Hallie Grace Bradley, Peter Jaymes Jr., Eric Podnar, Lucy Faust",United States,"September 1, 2019",2017,R,96 min,"Comedies, Independent Movies, Thrillers",A hapless guy agrees to help his stunning – but psychotic – girlfriend rob her loathsome sugar daddy in a scheme as ill-conceived as it is violent.
s140,TV Show,72 Dangerous Animals: Latin America,,Bob Brisbane,"Australia, United States","December 22, 2017",2017,TV-14,1 Season,"Docuseries, International TV Shows, Science & Nature TV","Powerful cats, indestructible arachnids and flesh-melting pit vipers are just the beginning in this series about Latin America's deadliest creatures."
s149,Movie,A Bad Moms Christmas,"Jon Lucas, Scott Moore","Mila Kunis, Kristen Bell, Kathryn Hahn, Susan Sarandon, Christine Baranski, Jay Hernandez, Cheryl Hines, Peter Gallagher, Justin Hartley","United States, China","February 14, 2020",2017,R,104 min,Comedies,"Stressed-out moms Amy, Carla and Kiki are back, and the looming Christmas holiday gets even more daunting when their mothers show up for a visit."
s153,TV Show,A Boy Name Flora A,,"Crowd Lu, Tsai Chen-nan, Lotus Wang, Fan Chu-Mei, Hsieh Ying-shiuan, Vera Yen, Cammy Chiang",Taiwan,"September 1, 2017",2017,TV-MA,1 Season,"International TV Shows, TV Comedies, TV Dramas",A 28-year-old layabout begins to re-examine his life when his dysfunctional family assembles to pay respects to a dying grandmother who won’t pass on.
s160,Movie,A Christmas Prince,Alex Zamm,"Rose McIver, Ben Lamb, Alice Krige, Honor Kneafsey",United States,"November 17, 2017",2017,TV-PG,92 min,"Children & Family Movies, Dramas, Romantic Movies",Christmas comes early for an aspiring young journalist when she's sent abroad to get the scoop on a dashing prince who's poised to be king.
s176,Movie,A Ghost Story,David Lowery,"Casey Affleck, Rooney Mara, Liz Franke, Rob Zabrecky, Will Oldham, Sonia Acevedo",United States,"January 7, 2020",2017,R,92 min,"Dramas, Independent Movies","Following a fatal car crash, a man's spirit remains stuck in the home he shared with his wife as doors into the past and future begin to open."
s183,Movie,A Gray State,Erik Nelson,,United States,"December 25, 2017",2017,TV-MA,93 min,Documentaries,"This documentary dissects the case of a filmmaker whose death, along with the deaths of his wife and daughter, sparked alt-right conspiracy theories."
s189,TV Show,A House of Blocks,,"Eli Shi, Phoebe Lin, Chen Wan-ting, Fan Chen-fei, Lu Hsueh-feng, Figaro Tseng, Winnie Chang, Elten Ting",Taiwan,"September 1, 2017",2017,TV-PG,1 Season,"International TV Shows, TV Dramas, TV Horror","Yijuan and her mentally ill sister Kaiqi struggle to be happy in the face of misfortune, criminal intrigue, marital strife, an exorcism and a ghost."
s192,TV Show,A Korean Odyssey,,"Lee Seung-gi, Cha Seung-won, Oh Yeon-seo, Lee Hong-gi, Jang Gwang, Lee Se-young",South Korea,"March 5, 2019",2017,TV-MA,1 Season,"International TV Shows, Korean TV Shows, Romantic TV Shows",A self-serving mythical creature's bid for invincibility backfires when he finds himself at the mercy of a woman who can see otherworldly beings.
s209,Movie,A new Capitalism,,,Brazil,"June 12, 2018",2017,TV-14,76 min,"Documentaries, International Movies","Entrepreneurs worldwide explore alternatives to current capitalist structures, advocating for profitable businesses that also tackle social inequality."
s231,Movie,A Sort of Family,Diego Lerman,"Bárbara Lennie, Daniel Aráoz, Claudio Tolcachir, Paula Cohen, Yanina Ávila","Argentina, Brazil, France, Poland, Germany, Denmark","April 1, 2018",2017,TV-14,96 min,"Dramas, International Movies, Thrillers",An Argentine doctor faces legal and ethical challenges when she travels to the countryside to pick up the infant she has been waiting to adopt.
s234,Movie,A StoryBots Christmas,"Evan Spiridellis, Jeff Gill","Edward Asner, Judy Greer, Erin Fitzgerald, Fred Tatasciore, Jeff Gill, Gregg Spiridellis, Evan Spiridellis, Jim Meskimen, Nate Theis",United States,"December 1, 2017",2017,TV-Y,26 min,"Children & Family Movies, Comedies","Bo thinks her holiday gift-giving isn't good enough, so she heads north to study under Santa Claus – only to find he's missing."
s247,Movie,A Very Country Christmas,Justin G. Dyck,"Bea Santos, Greyston Holt, Greg Vaughan, Deana Carter, Allison Hossack","United States, Canada","November 15, 2020",2017,TV-G,84 min,"Music & Musicals, Romantic Movies","When an unfulfilled country music star hides out in his hometown, he meets a budding interior designer who finds her way into his heart."
s253,Movie,A Week in Watts,Gregory Caruso,,United States,"February 19, 2018",2017,TV-14,91 min,Documentaries,"Los Angeles police officers embark on an innovative program mentoring promising students from the harsh, gang-infested Watts neighborhood."
s255,Movie,A Witches' Ball,Justin G. Dyck,"Morgan Neundorf, Karen Slater, Loukia Ioannou, Will Ennis, Renee Stein, Keith Cooper, Paul Mason, Lisa Scenna, Ashley Rogan",Canada,"October 1, 2018",2017,PG,91 min,Children & Family Movies,"Beatrix can't wait to be inducted as a witch, but an unfortunate incident threatens to take her pending title away if she doesn't act fast."
s265,Movie,Aadu 2,Midhun Manuel Thomas,"Jayasurya, Vinayakan, Sunny Wayne, Vijay Babu, Saiju Kurup, Vineeth Mohan, Unni Rajan P. Dev, Dharmajan Bolgatty, Indrans",India,"May 15, 2018",2017,TV-MA,150 min,"Comedies, International Movies","When Shaji Pappan and his gang of goofy outlaws find themselves low on funds, they plan to once again win a hefty prize in a tug-of-war competition."
s282,Movie,Abducted in Plain Sight,Skye Borgman,,United States,"January 15, 2019",2017,TV-14,90 min,Documentaries,"In this true crime documentary, a family falls prey to the manipulative charms of a neighbor, who abducts their adolescent daughter. Twice."
s285,TV Show,Abnormal Summit,"Jung-ah Im, Seung-uk Jo","Hyun-moo Jun, Si-kyung Sung, Se-yoon Yoo",South Korea," August 4, 2017",2017,TV-PG,2 Seasons,"International TV Shows, Korean TV Shows, Stand-Up Comedy & Talk Shows","Led by a trio of Korean celebs, a multinational panel of men engage in – usually – lighthearted debates on issues that surround Korea and beyond."
s302,Movie,Acts of Vengeance,Isaac Florentine,"Antonio Banderas, Karl Urban, Paz Vega, Robert Forster, Clint Dyer, Cristina Serafini, Lillian Blankenship, Atanas Srebrev, Mark Rhino Smith","Bulgaria, United States","January 25, 2018",2017,R,87 min,"Action & Adventure, International Movies","Devastated by the murder of his wife and child, a formerly fast-talking lawyer takes a vow of silence and trains himself for a mission of revenge."
s313,Movie,Aditi Mittal: Things They Wouldn't Let Me Say,Fazila Allana,Aditi Mittal,India,"July 18, 2017",2017,TV-MA,63 min,Stand-Up Comedy,"Trailblazing comic Aditi Mittal mixes topical stand-up with frank talk about being single, wearing thongs and the awkwardness of Indian movie ratings."
s316,Movie,Adrishya,Sandeep Chatterjee,"Ravi Kumar, Ayesha Singh, Nishat Mallick, Archana Kotwal, Rakesh Chaturvedi Om, Nidhi Mahavan, Abhijit Sinha, Abdur Rehman",India,"December 31, 2019",2017,TV-14,99 min,"Horror Movies, Independent Movies, International Movies",A family’s harmonious existence is interrupted when the young son begins showing symptoms of anxiety that seem linked to disturbing events at home.
s323,TV Show,Afronta! Facing It!,Juliana Vicente,"Loo Nascimento, Ingrid Silva, Rincon Sapiência, Batekoo, Gabriel Martins, Benjamin Abras, Daniele DaMata, Tasha & Tracie Okereke, Mariana de Matos, André Novais, Mahal Pita, Grace Passô, Thamyra Thâmara, Xenia França, Criola, Dani Ornellas, Anelis Assumpção, Magá Moura, Tássia Reis, Liniker, Yasmin Thayná, Raquel Virgínia, Juliana Luna, Erica Malunguinho, Diane Lima, Karol Conká",Brazil,"October 31, 2020",2017,TV-PG,1 Season,"Docuseries, International TV Shows","This docuseries spotlights Afro-Brazilian thinkers sharing their individual journeys and discussing representation, entrepreneurship and community."
s331,Movie,Aftermath,Elliott Lester,"Arnold Schwarzenegger, Scoot McNairy, Maggie Grace, Judah Nelson, Glenn Morshower, Hannah Ware, Mo McRae, Martin Donovan, Larry Sullivan, Mariana Klaveno, Kevin Zegers, Lewis Pullman","United Kingdom, United States","March 15, 2020",2017,R,94 min,Dramas,"After an air traffic controller's mistake results in a tragic accident, a man who lost his wife and daughter seeks answers from the man responsible."
s336,TV Show,Age Gap Love,,Fay Ripley,United Kingdom,"July 12, 2019",2017,TV-MA,1 Season,"British TV Shows, Reality TV, Romantic TV Shows","Despite the social backlash and challenges that come with intergenerational romance, these couples choose to stick together through thick and thin."
s339,TV Show,Age of Tanks,,,"Germany, France, Russia","November 10, 2018",2017,TV-PG,1 Season,"Docuseries, International TV Shows, Science & Nature TV",The history of military tanks unfolds in a documentary series that traces their role in history and geopolitics from World War I to the 21st century.
s362,Movie,Ajji,Devashish Makhija,"Sushama Deshpande, Abhishek Banerjee, Smita Tambe, Sharvani Suryavanshi, Vikas Kumar, Sadiya Siddiqui, Sudhir Pandey, Manuj Sharma",India,"May 1, 2018",2017,TV-MA,105 min,"Dramas, International Movies","When her small granddaughter is sexually assaulted by a powerful man and no justice is served, a poor, frail old woman plots her violent revenge."
s368,TV Show,Al Hayba,,"Taim Hasan, Nadine Nassib Njeim, Abdo Chahine, Oweiss Mkhallalati, Mona Wassef",Lebanon,"September 15, 2018",2017,TV-14,1 Season,"Crime TV Shows, International TV Shows, TV Dramas","In a village by the Lebanon-Syria border, the head of an arms-smuggling clan contends with family conflicts, power struggles and complicated love."
s370,Movie,Alakada Reloaded,Toyin Abraham,"Kehinde Bankole, Lilian Esoro, Bolaji Amusan, Toyin Abraham, Gabriel Afolayan, Bidemi Kosoko, Wumi Toriola, Tayo Amokade, Helen Paul, Liz DaSilva",,"March 6, 2020",2017,TV-MA,104 min,"Comedies, International Movies","To cope with her feelings of inferiority, a woman from an impoverished family tells tall tales of her wealth and influence to upgrade her social status."
s371,Movie,Alan Saldaña: Mi vida de pobre,"Raúl Campos, Jan Suter",Alan Saldaña,Mexico,"August 4, 2017",2017,TV-MA,54 min,Stand-Up Comedy,Mexican comic Alan Saldaña has fun with everything from the pressure of sitting in an exit row to maxing out his credit card in this stand-up special.
s372,Movie,Alarmoty in the Land of Fire,,,Egypt,"August 5, 2019",2017,TV-MA,94 min,"Comedies, International Movies","While vacationing at a resort, an ornery and outspoken man is held captive by a criminal organization."
s373,Movie,Alaska Is a Drag,Shaz Bennett,"Martin L. Washington Jr., Maya Washington, Matt Dallas, Christopher O'Shea, Jason Scott Lee, Margaret Cho, Kevin Daniels, John Fleck, Nia Peeples, Adam Tomei",United States,"December 31, 2020",2017,TV-MA,83 min,"Dramas, LGBTQ Movies","Tormented by bullies, an aspiring drag star working at an Alaskan cannery becomes a skilled fighter and is tapped for competition by a boxing coach."
s390,TV Show,Alias Grace,,"Sarah Gadon, Edward Holcroft, Paul Gross, Anna Paquin, Rebecca Liddiard, Zachary Levi, Kerr Logan, David Cronenberg",Canada,"November 3, 2017",2017,TV-MA,1 Season,"Crime TV Shows, International TV Shows, TV Dramas","In 19th-century Canada, a psychiatrist weighs whether a murderess should be pardoned due to insanity. Based on Margaret Atwood's award-winning novel."
s391,Movie,"Alias JJ, la celebridad del mal",,,,"September 1, 2017",2017,TV-MA,54 min,"Documentaries, International Movies","Witnesses and public figures respond to controversial claims about Pablo Escobar made by the Medellín Cartel's sole survivor, John Jairo Velásquez."
s396,Movie,Alien Contact: Outer Space,J. Michael Long,J. Michael Long,United States,"January 9, 2018",2017,TV-PG,63 min,Documentaries,This fact-based account delves into humankind's efforts to gather signals from possible intelligent beings beyond the solar system.
s403,Movie,All About Love,Adze Ugah,"Chris Attoh, Katlego Danke, Enyinna Nwigwe, Nomzamo Mbatha, Richard Lukunku, Zenande Mfenyane, Leroy Gopal, Angela Sithole",South Africa,"March 6, 2020",2017,TV-MA,79 min,"Dramas, International Movies, Romantic Movies",An inseparable couple struggles to stay together when betrayal threatens to tear their lives apart.
s412,TV Show,All Hail King Julien,,"Danny Jacobs, Andy Richter, Henry Winkler, Kevin Michael Richardson, India de Beaufort, Jeff Bennett, David Krumholtz, Diedrich Bader, Debra Wilson, Sarah Thyre, Betsy Sodaro",United States,"December 1, 2017",2017,TV-Y7,5 Seasons,"Kids' TV, TV Comedies","In this Emmy winner for Outstanding Children's Animated Program, Madagascar booty-shaker King Julien takes on the jungle’s craziest adventures."
s413,TV Show,All Hail King Julien: Exiled,,"Danny Jacobs, Andy Richter, Kevin Michael Richardson, India de Beaufort, Jeff Bennett, Maurice LaMarche",,"May 12, 2017",2017,TV-Y7,1 Season,"Kids' TV, TV Action & Adventure, TV Comedies","Julien's been dethroned, but loyal friends and some very unlikely allies will propel the lovable lemur on a colorful journey to take back his kingdom."
s417,Movie,All of You,Dan Villegas,"Jennylyn Mercado, Derek Ramsay, Yayo Aguila, Kean Cipriano, Nico Antonio, Enzo Marcos, Via Antonio, Hannah Ladesma",Philippines,"January 11, 2019",2017,TV-MA,104 min,"Comedies, Dramas, International Movies","Two strangers meet on a dating app and experience instant chemistry, but their relationship unravels as jarring differences catch up to them."
s422,Movie,All The Reasons To Forget,Pedro Coutinho,"Johnny Massaro, Bianca Comparato, Regina Braga, Maria Laura Nogueira, Victor Mendes, Thiago Amaral, Rafael Primot, Eduardo Mossri, Rita Batata, Larissa Ferrara",Brazil,"April 19, 2018",2017,TV-MA,90 min,"Comedies, Dramas, International Movies",A Brazilian man tries a myriad of ways to get over his breakup with his girlfriend but is surprised to learn it's more difficult than he anticipated.
s426,Movie,AllI Wish,Susan Walter,"Sharon Stone, Tony Goldwyn, Liza Lapira, Ellen Burstyn, Jason Gibson, Famke Janssen, Caitlin Fitzgerald, Gilles Marini, Erica Ash, Tom Paolino",United States,"March 18, 2020",2017,R,95 min,"Dramas, Romantic Movies","Over a series of birthdays, a happy-go-lucky, commitment-averse fashion designer strives to bring a bit of calm to her chaotic love life."
s436,Movie,AlphaGo,Greg Kohs,,United States,"January 1, 2018",2017,TV-G,90 min,Documentaries,"Seemingly simple but deceptively complex, the game of ""Go"" serves as the backdrop for this battle between artificial intelligence and man."
s445,Movie,Amar,Esteban Crespo,"María Pedraza, Pol Monen, Natalia Tena, Nacho Fresneda, Greta Fernández, Gustavo Salmerón, Celso Bugallo, Sonia Almarcha, Marta Belenguer",Spain,"July 15, 2017",2017,TV-MA,104 min,"Dramas, International Movies, Romantic Movies","Young Laura and Carlos experience the intensity and fragility of first love, as life realities gradually tarnish their idealized notions of romance."
s451,Movie,Amelia: A Tale of Two Sisters,Edward Cotterill,Rachael Stirling,United Kingdom,"June 1, 2017",2017,TV-PG,44 min,Documentaries,"Eight decades after her disappearance, Amelia Earhart's incredible accomplishments are still celebrated, thanks in large part to her sister Muriel."
s455,Movie,American Assassin,Michael Cuesta,"Dylan O'Brien, Michael Keaton, Sanaa Lathan, Shiva Negar, Taylor Kitsch, Trevor White, Navid Negahban, Scott Adkins, David Suchet, Sydney Rae White",United States,"January 31, 2020",2017,R,112 min,Action & Adventure,"After grad student Mitch Rapp suffers a tragic loss during a terrorist attack, his single-minded thirst for vengeance catches the interest of the CIA."
s457,Movie,American Circumcision,Brendon Marotta,,United States,"December 16, 2018",2017,TV-14,101 min,Documentaries,"With interviews from experts on both sides of the debate, this film questions the routine practice of non-religious infant circumcision in the U.S."
s458,TV Show,American Crime,,"Felicity Huffman, Timothy Hutton, Elvis Nolasco, Regina King, Lili Taylor, Richard Cabral, Brent Anderson, Benito Martinez, Shane Jacobsen, W. Earl Brown, Caitlin Gerard, Penelope Ann Miller, Johnny Ortiz",United States,"May 30, 2017",2017,TV-MA,3 Seasons,"Crime TV Shows, TV Dramas","This anthology series unfolds a different story arc for each season, with dramas focusing on aspects of American life and the criminal justice system."
s460,Movie,American Experience: Ruby Ridge,Barak Goodman,"Dave Hunt, Bo Gritz, Sara Weaver",United States,"April 19, 2017",2017,TV-MA,53 min,Documentaries,"A botched attempt to arrest a white supremacist in Idaho results in a gun battle, a standoff and three deaths that galvanize public opinion in 1992."
s479,TV Show,AMO,,"Derek Ramsay, Vince Rillon, Allen Dizon, Felix Roco, Ruby Ruiz",Philippines,"April 9, 2018",2017,TV-MA,1 Season,"International TV Shows, TV Dramas","Despite the Philippine government's crackdown on narcotics, high schooler Joseph expands his drug running while his cop uncle profits from corruption."
s480,Movie,Among Family,Ozan Açıktan,"Engin Günaydın, Demet Evgar, Erdal Özyagcilar, Su Kutlu, Devrim Yakut, Fatih Artman, Gülse Birsel, Sevket Çoruh, Derya Karadas, Devin Özgür Cinar",Turkey,"February 15, 2019",2017,TV-14,127 min,"Comedies, International Movies","Amid a marital crisis, Fikret befriends songstress Solmaz after a wacky encounter and must fill in as the father of her soon-to-wed daughter."
s484,Movie,Amy Schumer: The Leather Special,Amy Schumer,Amy Schumer,United States,"March 7, 2017",2017,TV-MA,57 min,Stand-Up Comedy,"Comic sensation Amy Schumer riffs on sex, dating and the absurdities of fame in a bold and uncensored stand-up set at Denver's Bellco Theater."
s494,Movie,An Imperfect Murder,James Toback,"Sienna Miller, Alec Baldwin, Charles Grodin, Colleen Camp, John Buffalo Mailer, Nick Mathews, Steven Prescod, Oliver ""Power"" Grant, James Toback",United States,"January 13, 2021",2017,R,71 min,"Dramas, Thrillers","Haunted by a nightmare involving her abusive ex-boyfriend, an actress begins to question her reality and whether the incident took place."
s497,Movie,An Ordinary Man,Brad Silberling,"Ben Kingsley, Hera Hilmar, Peter Serafinowicz","Serbia, United States","October 1, 2020",2017,R,91 min,"Dramas, Thrillers","A war criminal in hiding begins to suspect that the maid, his only confidant and contact with the outside world, may be hiding something herself."
