show_id,type,title,director,cast,country,date_added,release_year,rating,duration,listed_in,description
s5,Movie,21,Robert Luketic,"Jim Sturgess, Kevin Spacey, Kate Bosworth, Aaron Yoo, Liza Lapira, Jacob Pitts, Laurence Fishburne, Jack McGee, Josh Gad, Sam Golzari, Helen Carey, Jack Gilpin",United States,"January 1, 2020",2008,PG-13,123 min,Dramas,A brilliant group of students become card-counting experts with the intent of swindling millions out of Las Vegas casinos by playing blackjack.
s10,Movie,1920,Vikram Bhatt,"Rajneesh Duggal, Adah Sharma, Indraneil Sengupta, Anjori Alagh, Rajendranath Zutshi, Vipin Sharma, Amin Hajee, Shri Vallabh Vyas",India,"December 15, 2017",2008,TV-MA,143 min,"Horror Movies, International Movies, Thrillers",An architect and his wife move into a castle that is slated to become a luxury hotel. But something inside is determined to stop the renovation.
s51,Movie,"10,000 B.C.",Roland Emmerich,"Steven Strait, Camilla Belle, Cliff Curtis, Joel Virgel, Affif Ben Badra, Mo Zinal, Nathanael Baring, Mona Hammond, Omar Sharif","United States, South Africa","June 1, 2019",2008,PG-13,109 min,Action & Adventure,Fierce mammoth hunter D'Leh sets out on an impossible journey to rescue the woman he loves from a vicious warlord and save the people of his village.
s78,Movie,2 Alone in Paris,"Ramzy Bedia, Éric Judor","Ramzy Bedia, Éric Judor, Benoît Magimel, Kristin Scott Thomas, Élodie Bouchez, Édouard Baer, Fred Testot, Omar Sy",France,"June 1, 2020",2008,TV-MA,97 min,"Comedies, International Movies","A bumbling Paris policeman is doggedly determined to capture the master thief that repeatedly eludes him, even when they're the last two men on Earth."
s250,Movie,A Very Special Love,Cathy Garcia-Molina,"John Lloyd Cruz, Sarah Geronimo, Dante Rivero, Rowell Santiago, Johnny Revilla, Bing Pimental, Daphne Oseña-Paez, Al Tantay, Irma Adlawan, Arno Morales, Miles Ocampo",Philippines,"November 12, 2020",2008,TV-G,107 min,"International Movies, Romantic Movies","After landing a job working for her longtime crush, an optimistic woman realizes that the man of her dreams isn't exactly who she envisioned."
s252,Movie,A Wednesday,Neeraj Pandey,"Anupam Kher, Naseeruddin Shah, Jimmy Shergill, Deepal Shaw, Aamir Bashir, Kali Prasad Mukherjee, Vijay Bhatia, Chetan Pandit",India,"November 1, 2018",2008,TV-MA,103 min,"Action & Adventure, Dramas, International Movies","After receiving an anonymous tip about a bomb, a police commissioner must negotiate with the terrorist, who demands the release of four militants."
s270,Movie,Aamir,Raj Kumar Gupta,"Rajeev Khandelwal, Gajraj Rao, Shashanka Ghosh, Jhilmil Hazrika, Gazala Amin, Allauddin Khan",India,"November 1, 2018",2008,TV-14,95 min,"International Movies, Thrillers","In this high-tension thriller, an anonymous caller on a cell phone threatens to harm a man's family if he doesn't carry out every order."
s332,Movie,Afterschool,Antonio Campos,"Ezra Miller, Addison Timlin, Jeremy Allen White, Michael Stuhlbarg, Emory Cohen, David Costabile, Rosemarie DeWitt, Dariusz M. Uczkowski, Gary Wilmes, Paul Sparks, Alexandra Neil, Lee Wilkof",United States,"August 13, 2020",2008,TV-MA,107 min,"Dramas, Independent Movies","When a prep school loner films two classmates overdosing on cocaine, his footage plays a role in the emotional fallout within the school community."
s507,Movie,Andaleeb El Dokki,Wael Ehsan,"Mohamed Henedi, Heba Nour, Dawood Hussain, Amr Abdel-Geleel, Mohammed El Sadaany, Mohamed Sherif Hassan",Egypt,"June 2, 2020",2008,TV-14,106 min,"Comedies, International Movies","Aiming for fame, a struggling singer finds his long-lost millionaire twin and falls for his brother's secretary as a plot brews to steal the fortune."
s797,Movie,Because of Soccer,"Agasyah Karim, Khalid Kashogi","Herjunot Ali, Winky Wiryawan, Erly Ashy, Laura Basuki, Tarzan, Aida Nurmala, Otto Djauhari, Indra Herlambang",Indonesia,"December 8, 2018",2008,TV-14,75 min,"Comedies, Dramas, International Movies","After losing a World Cup bet, two hapless buddies must use their wits to pay off their debt to a big Jakarta bookie in this action-packed comedy."
s803,Movie,Bedtime Stories,Adam Shankman,"Adam Sandler, Keri Russell, Guy Pearce, Russell Brand, Richard Griffiths, Jonathan Pryce, Courteney Cox, Lucy Lawless, Teresa Palmer, Aisha Tyler, Laura Ann Kesling, Jackie Sandler, Lorna Scott, Dana Min Goodman, Andrew Collins, Jonathan Loughran, Jonathan Morgan Heit, Nick Swardson, Tim Herlihy, Billy Tyler, Johntae Lipscomb, Mikey Post, Sebastian Saraceno, Bill Romanowski, Sadie Sandler, Carmen Electra, Allen Covert, Kathryn Joosten, Annalise Basso, Blake Clark, Julia Lea Wolov, Sarah G. Buxton",United States,"March 5, 2019",2008,PG,100 min,"Children & Family Movies, Comedies",Skeeter's life is turned upside down when the fantastical stories he makes up to entertain his niece and nephew inexplicably turn into reality.
s839,Movie,Berlin Calling,Hannes Stöhr,"Paul Kalkbrenner, Rita Lengyel, Corinna Harfouch, Araba Walton, Peter Schneider, Rolf Peter Kahl, Henriette Müller, Udo Kroschwald, Megan Gay, Max Mauff",Germany,"January 15, 2017",2008,TV-MA,105 min,"Dramas, International Movies, Music & Musicals","DJ Ickarus is at the top of his game, dazzling fans and touring the world – until he gets locked in the loony bin after taking a few too many drugs."
s975,Movie,Bleach The Movie: Fade to Black,Noriyuki Abe,"Masakazu Morita, Fumiko Orikasa, Aya Hirano, Hiroshi Kamiya, Mitsuaki Madono, Ryotaro Okiayu, Kentaro Ito, Shinichiro Miki, Satsuki Yukino, Masaaki Tsukada",Japan,"October 15, 2016",2008,TV-PG,94 min,"Action & Adventure, Anime Features, Sci-Fi & Fantasy","When his mind is fogged by a scimitar-weilding stranger, Mayuri destroys his laboratory, unleashing a cloud of reishi that lays waste to the Seiretei."
s1031,Movie,Bolt,"Byron Howard, Chris Williams","John Travolta, Miley Cyrus, Susie Essman, Mark Walton, Malcolm McDowell, James Lipton, Greg Germann, Diedrich Bader, Nick Swardson, J.P. Manoux, Dan Fogelman, Kari Wahlgren, Chloë Grace Moretz, Randy Savage, Ronn Moss, John DiMaggio, Daran Norris, Jeff Bennett, Brian Stepanek, Todd Cummings",United States,"July 22, 2018",2008,PG,99 min,"Children & Family Movies, Comedies","This tale follows German shepherd Bolt, a canine actor who makes a cross-country trek when he's mistakenly shipped from Hollywood to New York City."
s1066,Movie,Boushkash,"Ahmed Yousry, Hazem Fouda","Mohamed Saad, Zeina, Ezzat Abou Aouf, Edward, Hassan Hosny, Ahmed Rateb, Hamdi el Sakhawy, Safaa El-Toukhy",Egypt,"April 28, 2020",2008,TV-MA,100 min,"Comedies, International Movies",A former goalkeeper-turned-talent scout embarks on a mischievous adventure to recruit players for Egyptian football clubs.
s1160,Movie,C Kkompany,Sachin Yardi,"Mahesh Bhatt, Mithun Chakraborty, G.K. Desai, Celina Jaitly, Karan Johar, Ekta Kapoor, Tusshar Kapoor, Anupam Kher, Ashok Pandit, Lalit Parashar, Raima Sen, Rajpal Yadav",India,"May 31, 2019",2008,TV-14,127 min,"Action & Adventure, Comedies, International Movies","To blow off some steam, friends Akshay, Joshi and Lambodar, posing as a gang called C Kkompany, make a phony extortion demand to Joshi's apathetic son. The trio is shocked when their prank call makes them anonymous celebrities."
s1217,Movie,Caregiver,Chito S. Roño,"Sharon Cuneta, John Estrada, John Manalo, Rica Peralejo, Jhong Hilario, Saul Reichlin, Matthew Rutherford, Claire Jeater, Makisig Morales, Mickey Ferriols",Philippines,"March 5, 2019",2008,TV-14,131 min,"Dramas, International Movies","Sarah leaves her son in the Philippines to reunite with her husband in London, where she struggles personally and professionally as a care-home worker."
s1407,TV Show,CLANNAD,,"Yuichi Nakamura, David Matranga, Mai Nakahara, Luci Christian, Ryo Hirohashi, Shelley Calene-Black, Ai Nonaka, Hilary Haag, Akemi Kanda, Brittney Karbowski, Houko Kuwashima, Kaytha Coker, Mamiko Noto, Emily Neves, Daisuke Sakaguchi, Greg Ayres",Japan,"November 1, 2019",2008,TV-PG,2 Seasons,"Anime Series, Teen TV Shows",Maladjusted high school student Tomoya's life begins to change when he befriends his classmate Nagisa and several other eccentric girls.
s1429,Movie,Cloverfield,Matt Reeves,"Lizzy Caplan, Jessica Lucas, T.J. Miller, Michael Stahl-David, Mike Vogel, Odette Annable, Anjul Nigam, Margot Farley, Theo Rossi, Brian Klugman",United States,"January 1, 2020",2008,PG-13,85 min,"Action & Adventure, Horror Movies, Sci-Fi & Fantasy",A going-away party in Manhattan is interrupted when a mysterious monster of epic proportions launches an attack on New York City.
s1448,TV Show,Code Geass: Lelouch of the Rebellion,,"Jun Fukuyama, Takahiro Sakurai, Yukana, Ami Koshimizu, Kaori Nazuka, Fumiko Orikasa, Sayaka Ohara, Noriaki Sugiyama, Takahiro Mizushima, Soichiro Hoshi, Yuko Goto",Japan,"May 1, 2019",2008,TV-MA,2 Seasons,"Anime Series, International TV Shows",A high-schooler who's granted powers to make anyone instantly obedient dons a mask to lead Japan's rebellion against a long-invading Britannia.
s1468,Movie,Colours of Passion,Ketan Mehta,"Randeep Hooda, Nandana Sen, Jim Boeven, Paresh Rawal, Tom Alter, Vikram Gokhale, Vipin Sharma, Gaurav Dwivedi",India,"May 25, 2018",2008,TV-14,114 min,"Dramas, International Movies","Seeking inspiration, a young 19th-century painter finds a woman who is his love, his muse and his willing subject, but his work becomes controversial."
s1490,Movie,Contract,Ram Gopal Varma,"Adhvik Mahajan, Prasad Purandhare, Sakshi Gulati, Zakir Hussain, Amruta Subhash, Kishore Kadam, Sumeet Nijhawan, Upyendra Limaye",India,"March 2, 2019",2008,TV-14,116 min,"Action & Adventure, Dramas, Independent Movies","Following the death of his wife and daughter in a terrorist attack, an ex-Indian army commando agrees to infiltrate a terrorist cell."
s1653,TV Show,Dead Set,,"Jaime Winstone, Andy Nyman, Kevin Eldon, Davina McCall, Warren Brown, Riz Ahmed, Beth Cordingly, Kathleen McDermott, Raj Ghatak",United Kingdom,"September 1, 2016",2008,TV-MA,1 Season,"British TV Shows, TV Horror, TV Thrillers","While the housemates in the Big Brother house remain oblivious, fast-moving hordes of the undead decimate the studio compound."
s1686,Movie,Defiance,Edward Zwick,"Daniel Craig, Liev Schreiber, Jamie Bell, Alexa Davalos, Allan Corduner, Mark Feuerstein, Tomas Arana, Jodhi May, Kate Fahy, Iddo Goldberg, George MacKay, Iben Hjejle, Martin Hancock, Jacek Koman, Ravil Isyanov",United States,"November 27, 2019",2008,R,137 min,"Action & Adventure, Dramas","In this action-packed drama based on an extraordinary true story, four brothers protect more than 1,000 Jewish refugees during World War II."
s1770,TV Show,Dinosaur King,,"Megumi Matsumoto, Matsuri Mizuguchi, Tomoko Kobashi, Asuka Tanii, Seiko Tamura, Veronica Taylor, Sebastian Arcelus, Kether Donohue, Rachael Lillis, Madeleine Blaustein",Japan,"June 2, 2018",2008,TV-Y7,2 Seasons,"Anime Series, Kids' TV","Aided by tablets found near a downed meteorite, Max, Rex and Zoe race the evil Alpha Gang as they travel the globe in search of living dinosaurs."
s1832,Movie,Dostana,Tarun Mansukhani,"Abhishek Bachchan, John Abraham, Priyanka Chopra, Bobby Deol, Kiron Kher, Sushmita Mukherjee, Shrey Bawa, Boman Irani","India, United States","April 1, 2020",2008,TV-14,142 min,"Comedies, Dramas, International Movies","To win over a landlady who only accepts women as tenants, two men pose as a couple – but the jig may be up when they both fall for their flatmate."
s1837,Movie,Doubt,John Patrick Shanley,"Meryl Streep, Philip Seymour Hoffman, Amy Adams, Viola Davis, Alice Drummond, Audrie Neenan, Susan Blommaert, Carrie Preston, Lydia Jordan, Lloyd Clay Brown",United States,"March 7, 2019",2008,PG-13,104 min,"Dramas, Faith & Spirituality","Sister Aloysius begins to have doubts about doting Father Flynn, who seems to have become overly involved in the life of an African American pupil."
s1871,TV Show,DreamWorks Kung Fu Panda Awesome Secrets,,"Jack Black, Dustin Hoffman, Dennis Haysbert, Paul Scheer, Randall Duk Kim, David Cross, Jessica DiCicco, Jaycee Chan, Angelina Jolie, Seth Rogen, Tony Leondis",United States,"July 1, 2019",2008,TV-PG,1 Season,"Kids' TV, TV Action & Adventure, TV Comedies","In this pair of adventures, Po tells the story of how masters Thundering Rhino, Storming Ox and Croc met and takes on Shifu's biggest challenge yet."
s1872,TV Show,DreamWorks Shrek's Swamp Stories,,"Mike Myers, Eddie Murphy, Cameron Diaz, Antonio Banderas, Kristen Schaal, Simon Cowell, Gilles Marini, Charlotte Newhouse, Dean Edwards, Cody Cameron, Christopher Knights, Conrad Vernon",United States,"February 17, 2020",2008,TV-PG,1 Season,"Kids' TV, TV Action & Adventure, TV Comedies","Shrek celebrates Halloween, Puss in Boots is captured by soldiers, and the gang participates in a kingdom-wide singing competition."
s1924,TV Show,Edge of the Universe,,,United Kingdom,"August 1, 2016",2008,TV-G,1 Season,"British TV Shows, Docuseries, Science & Nature TV","Leading astronomers reveal the latest discoveries about death-trap planets, asteroids, comets and other wonders of the cosmos."
s1947,TV Show,El Cartel,,"Manolo Cardona, Karen Martínez, Robinson Díaz, Diego Cadavid, Fernando Solórzano, Julian Arango, Sandra Reyes, Juan Pablo Raba, Fernando Arévalo",Colombia,"August 24, 2018",2008,TV-MA,1 Season,"Crime TV Shows, International TV Shows, Spanish-Language TV Shows",One man makes a fateful decision to get involved with a Colombian drug cartel in this series based on a novel by Andrés López López.
s1989,Movie,EMI: Liya Hai To Chukana Padega,Saurabh Kabra,"Sanjay Dutt, Arjun Rampal, Malaika Arora, Aashish Chaudhary, Neha Uberoi, Urmila Matondkar, Manoj Joshi, Daya Shanker Pandey, Pushkar Jog, Kulbhushan Kharbanda",India,"May 15, 2019",2008,TV-14,128 min,"Comedies, Dramas, International Movies",A bank hires an enigmatic and unorthodox debt collector to recover money from four borrowers who are unable to pay their loans.
s2059,TV Show,Exclusive Edition,James Lee,"Berg Lee, Yise Loo, Alvin Wong, Hady, Monday Kang, Ruobing, Wymen Yang, May June, Aenie Wong, Ernest Chong",,"August 14, 2017",2008,TV-14,1 Season,"International TV Shows, TV Dramas","Young journalists working for a magazine juggle careers, romance and other challenges while reporting on social issues and news stories in Malaysia."
s2120,Movie,Fashion,Madhur Bhandarkar,"Priyanka Chopra, Kangana Ranaut, Mugdha Godse, Arbaaz Khan, Arjan Bajwa, Raj Babbar, Kiran Juneja, Samir Soni",India,"August 2, 2018",2008,TV-MA,158 min,"Dramas, International Movies",A small-town girl finally realizes her dream of becoming a famous supermodel but soon finds there's a price for her glamorous new life.
s2158,Movie,Figaro Pho,Luke Jurevicius,Luke Jurevicius,United Kingdom,"September 1, 2016",2008,TV-Y7,29 min,"Children & Family Movies, Comedies",Quirky little Figaro has a whole alphabet's worth of phobias. These wordless animated shorts follow his many fears from A to Z.
s2203,Movie,Flash of Genius,Marc Abraham,"Greg Kinnear, Lauren Graham, Dermot Mulroney, Alan Alda, Bill Smitrovich, Mitch Pileggi, Daniel Roebuck, Tim Kelleher, Aaron Abrams, Chuck Shamata, Andrew Gillies","Canada, United States","January 16, 2017",2008,PG-13,119 min,Dramas,A college professor goes up against the giants of the auto industry when they fail to give him credit for inventing intermittent windshield wipers.
s2249,Movie,Four Christmases,Seth Gordon,"Vince Vaughn, Reese Witherspoon, Robert Duvall, Sissy Spacek, Jon Voight, Jon Favreau, Mary Steenburgen, Dwight Yoakam, Tim McGraw, Kristin Chenoweth","Germany, United States","January 1, 2021",2008,PG-13,88 min,"Comedies, Romantic Movies",A dating couple is forced to spend their first Christmas together visiting each of their four divorced parents – in a single day.
s2303,Movie,Frozen River,Courtney Hunt,"Melissa Leo, Misty Upham, Charlie McDermott, Michael O'Keefe, Mark Boone Junior, James Reilly, Jay Klaitz, John Canoe, Dylan Carusona, Michael Sky",United States,"July 1, 2019",2008,R,97 min,"Dramas, Independent Movies","On a Mohawk reservation on the Canadian border, Ray Eddy teams with a widowed tribe member to smuggle illegal immigrants into the United States."
s2357,Movie,Garfield's Fun Fest,"Mark A.Z. Dippé, Eondeok Han","Frank Welker, Tim Conway, Gregg Berger, Wally Wingert, Audrey Wasilewski, Fred Tatasciore, Stephen Stanton, Jennifer Darling, Neil Ross, Greg Eagles","United States, South Korea","January 1, 2020",2008,TV-Y7,79 min,"Children & Family Movies, Comedies","Garfield has long been the champ at a yearly competition for the funniest comic strip. But this time, Garfield must battle tall, handsome Ramone."
s2389,Movie,Get Smart,Peter Segal,"Steve Carell, Anne Hathaway, Dwayne Johnson, Alan Arkin, Terence Stamp, Terry Crews, David Koechner, James Caan, Masi Oka, Nate Torrence, Bill Murray",United States,"April 1, 2019",2008,PG-13,110 min,"Action & Adventure, Comedies","When the identities of secret agents are compromised, hapless Maxwell Smart teams with far more capable Agent 99 to thwart an evil terrorist group."
s2417,Movie,Gina Yashere: Skinny B*tch,,Gina Yashere,United Kingdom,"December 31, 2018",2008,TV-MA,58 min,Stand-Up Comedy,"Standup comedian and ""Daily Show"" correspondent Gina Yashere delivers a sharp set of wry observations on the environment, money and more."
s2471,Movie,Golmaal Returns,Rohit Shetty,"Ajay Devgn, Kareena Kapoor, Arshad Warsi, Tusshar Kapoor, Shreyas Talpade, Celina Jaitly, Amrita Arora, Anjana Sukhani",India,"September 28, 2020",2008,TV-MA,135 min,"Comedies, International Movies, Music & Musicals",A man's relationship with his jealous wife enters choppy waters after he has to spend a night on a yacht with a woman he's rescued from gangsters.
s2511,Movie,Gran Torino,Clint Eastwood,"Clint Eastwood, Bee Vang, Ahney Her, Christopher Carley, John Carroll Lynch, Brian Haley, Geraldine Hughes, Brian Howe, William Hill, Dreama Walker","Germany, United States","October 1, 2020",2008,R,117 min,Dramas,A newly widowed Korean War veteran faces his racism and his past when the son of the Hmong family next door tries to steal his beloved 1972 Gran Torino.
s2556,TV Show,Gunslinger Girl,,"Yuuka Nanri, Kanako Mitsuhashi, Eri Sendai, Ami Koshimizu, Hidenobu Kiuchi, Mitsuru Miyamoto, Masashi Ebara, Norihiro Inoue, Rie Nakagawa, Masami Iwasaki, Laura Bailey, Luci Christian, Caitlin Glass, Alese Johnson, Monica Rial, Jerry Jewell, Stephanie Young, Mike McFarland",Japan,,2008,TV-14,2 Seasons,"Anime Series, Crime TV Shows","On the surface, the Social Welfare Agency appears to help orphaned schoolgirls, but it's actually turning them into lethal agents."
s2631,Movie,Harold & Kumar Escape from Guantanamo Bay,"Jon Hurwitz, Hayden Schlossberg","John Cho, Kal Penn, Rob Corddry, Jack Conley, Roger Bart, Neil Patrick Harris, Danneel Ackles, Eric Winter, Paula Garcés, Jon Reep, Missi Pyle",United States,"October 1, 2019",2008,R,101 min,"Comedies, Cult Movies",Harold and Kumar jump on a plane to catch up with Harold's love interest but must change their plans when Kumar is accused of being a terrorist.
s2783,Movie,Holy Man 2,Note Chern-Yim,"Apisit Opasaimlikit, Suthep Po-ngam, Phichet Iamchaonaa, Note Chern-Yim",Thailand,"July 30, 2018",2008,TV-14,92 min,"Comedies, Faith & Spirituality, International Movies","Former rap musician Joey Boy is now a monk who takes Father Teng's place at his rural temple, where a crisis develops involving a nearby stone quarry."
s2943,Movie,Igor,Tony Leondis,"John Cusack, Steve Buscemi, Sean Hayes, Molly Shannon, Eddie Izzard, Jennifer Coolidge, Jay Leno","United States, France","September 1, 2019",2008,PG,87 min,Children & Family Movies,"Igor, the brilliant but deformed assistant to mad Dr. Glickenstein, dreams of winning the Evil Science Fair and the heart of village beauty Gretchen."
s2991,Movie,Indiana Jones and the Kingdom of the Crystal Skull,Steven Spielberg,"Harrison Ford, Cate Blanchett, Karen Allen, Ray Winstone, John Hurt, Jim Broadbent, Igor Jijikine, Shia LaBeouf",United States,"January 1, 2019",2008,PG-13,123 min,"Action & Adventure, Children & Family Movies, Sci-Fi & Fantasy","Indiana Jones is drawn into a Russian plot to unearth the Crystal Skulls of Akator, Amazonian artifacts with supernatural powers."
s3007,Movie,Inkheart,Iain Softley,"Brendan Fraser, Paul Bettany, Helen Mirren, Jim Broadbent, Andy Serkis, Sienna Guillory, Eliza Bennett, Rafi Gavron, Lesley Sharp, Jamie Foreman","Germany, United Kingdom, United States","July 1, 2019",2008,PG,106 min,"Action & Adventure, Children & Family Movies, Sci-Fi & Fantasy","Unbeknownst to his 12-year-old daughter, a bookbinder has a secret ability to bring characters to life by reading their stories out loud."
s3030,Movie,Interview with a Serial Killer,Christopher Martin,Arthur Shawcross,United States,"August 1, 2016",2008,TV-MA,45 min,Documentaries,"In this jailhouse interview, Arthur Shawcross, the Genesee River Killer, shares candid details of his crimes and his surprising family bonds."
s3048,Movie,Ip Man,Wilson Yip,"Donnie Yen, Simon Yam, Louis Fan, Lam Ka Tung, Xing Yu, Wong You-nam, Chen Zhi Hui, Lynn Hung, Hiroyuki Ikeuchi","Hong Kong, China","January 15, 2016",2008,R,107 min,"Action & Adventure, Dramas, International Movies","An occupying Japanese general challenges Chinese men to duels to prove the superiority of the Japanese, but Ip Man refuses to fight – at first."
s3094,Movie,Jaane Tu... Ya Jaane Na,Abbas Tyrewala,"Imran Khan, Genelia D'Souza, Manjari Fadnis, Ayaz Khan, Prateik, Ratna Pathak Shah, Arbaaz Khan, Sohail Khan",India,"January 10, 2021",2008,TV-14,147 min,"Comedies, International Movies, Music & Musicals",Soft-spoken Jai and spitfire beauty Aditi couldn't be more different – but their family and friends know that they're a perfect match.
s3127,TV Show,Japanese Style Originator,,"Takeo Chii, Hisako Manda, Takahiro Azuma, Kazuya Masuda",Japan,"May 1, 2017",2008,TV-G,1 Season,"International TV Shows, Stand-Up Comedy & Talk Shows","Find out everything there is to know about Japanese tradition, from food to culture to objects and arts, and the people who are continuing it today."
s3141,Movie,Jeff Dunham's Very Special Christmas Special,Michael Simon,"Jeff Dunham, Brian Haner",United States,"March 15, 2019",2008,TV-MA,85 min,Stand-Up Comedy,"Politically incorrect, sometimes raunchy ventriloquist Jeff Dunham is joined by his irreverent cast of characters in this hilarious Christmas special."
s3153,TV Show,Jericho,,"Skeet Ulrich, Lennie James, Ashley Scott, Kenneth Mitchell, Brad Beyer, April Parker-Jones, Alicia Coppola, Pamela Reed, Bob Stephenson, Gerald McRaney, Clare Carey, Richard Speight Jr., Michael Gaston, Erik Knudsen, Shoshannah Stern, Sprague Grayden",United States,"August 16, 2017",2008,TV-14,2 Seasons,"Classic & Cult TV, TV Action & Adventure, TV Dramas","Jake returns to his Kansas town to collect an inheritance, but a nuclear blast cuts off the outside world and makes him a reluctant leader amid chaos."
s3196,Movie,Jodhaa Akbar,Ashutosh Gowariker,"Hrithik Roshan, Aishwarya Rai Bachchan, Sonu Sood, Poonam Sinha, Suhasini Mulay, Ila Arun, Raza Murad, Kulbhushan Kharbanda, Abeer Abrar",India,"October 1, 2018",2008,TV-14,214 min,"Action & Adventure, Dramas, International Movies","In 16th-century India, what begins as a strategic alliance between a Mughal emperor and a Hindu princess becomes a genuine opportunity for true love."
s3312,Movie,Karzzzz,Satish Kaushik,"Himesh Reshammiya, Urmila Matondkar, Shweta Kumar, Dino Morea, Raj Babbar, Danny Denzongpa, Gulshan Grover, Rohini Hattangadi, Asrani, Smita Bansal",India,"October 22, 2017",2008,TV-14,137 min,"International Movies, Music & Musicals, Romantic Movies","When flashbacks reveal that he's the reincarnation of a man murdered by his wife, rock star Monty sets out to get revenge for the decades-old crime."
s3411,Movie,Kismat Konnection,Aziz Mirza,"Shahid Kapoor, Vidya Balan, Juhi Chawla, Om Puri, Vishal Malhotra, Karanvir Bohra, Amit Varma",India,"October 1, 2018",2008,TV-PG,145 min,"Comedies, International Movies, Music & Musicals","A man finds his lucky charm in the form of a woman whom he had once clashed with on every level, but on whose presence he must now rely to succeed."
s3840,Movie,Mad Money,"Callie Khouri, Jesse V. Johnson","Diane Keaton, Queen Latifah, Katie Holmes, Ted Danson, Roger Cross, Adam Rothenberg, Stephen Root, Christopher McDonald, Meagen Fay, J.C. MacKenzie, Finesse Mitchell, Eric Keenleyside",United States,"November 1, 2019",2008,PG-13,99 min,Comedies,A woman joins the janitorial staff of the Federal Reserve Bank and conspires with two co-workers to pilfer old money that's scheduled to be destroyed.
s3844,Movie,Madagascar: Escape 2 Africa,"Eric Darnell, Tom McGrath","Ben Stiller, Chris Rock, David Schwimmer, Jada Pinkett Smith, Sacha Baron Cohen, Cedric the Entertainer, Andy Richter, Bernie Mac, Alec Baldwin, Sherri Shepherd",United States,"May 1, 2020",2008,PG,91 min,"Children & Family Movies, Comedies","A botched rescue strands Alex the lion and his companions in Africa. Sadly, Alex discovers he has little in common with the locals."
s4035,Movie,Menahi,Ayman Makram,"Fayez Al-Malki, Mona Wasef, Abdel Imam Abdullah, Reem Abdel Aziz, Dana Jabr, Emad Al Youssef, Remas Mansoor, Khalid Mengah",Saudi Arabia,"June 11, 2020",2008,TV-14,101 min,"Comedies, International Movies","A stranger to civilian life, a young Saudi farmer travels to Dubai, where he experiences a series of hilarious misadventures."
s4094,Movie,Mike Birbiglia: What I Should Have Said Was Nothing: Tales from My Secret Public Journal,,Mike Birbiglia,United States,"November 22, 2019",2008,TV-MA,56 min,Stand-Up Comedy,Mike Birbiglia performs in this live concert special that features a riotous selection of the unique insights and observations culled from his diary.
