show_id,type,title,director,cast,country,date_added,release_year,rating,duration,listed_in,description
s3650,TV Show,Lion Pride,,"Yen Tsao, Amanda Chou, Kevin Liu, Peace Yang, Kenny Wen, Tzu-chiang Chao, Vince Kao, Lin Ching-Tai, Lin He Xuan, Michael Yang",Taiwan,"December 21, 2018",2017,TV-MA,1 Season,"International TV Shows, Romantic TV Shows, TV Comedies","After crossing paths at a crime scene, a renowned math teacher and an antiques appraiser embark on an unexpected journey of love and self-discovery."
s3654,Movie,Listen,Philippe Aractingi,"Hadi Bou Ayash, Ruba Zarour, Yara Bou Nassar, Rafik Ali Ahmad, Joseph Bou Nassar, Lama Lawand",Lebanon,"October 19, 2020",2017,TV-MA,103 min,"Dramas, Independent Movies, International Movies","A sound engineer falls for a model but after an unfortunate accident, he fights to save their love by triggering her senses."
s3660,Movie,Little Evil,Eli Craig,"Adam Scott, Evangeline Lilly, Bridget Everett, Owen Atlas, Chris D'Elia, Donald Faison, Clancy Brown, Tyler Labine, Kyle Bornheimer, Carla Gallo, Brad Williams, Sally Field",United States,"September 1, 2017",2017,TV-MA,95 min,"Comedies, Horror Movies","In this horror-comedy, a recently married man who wants to bond with his stepson begins to fear that the boy is a demon."
s3678,TV Show,Little Witch Academia,,"Megumi Han, Fumiko Orikasa, Michiyo Murase, Yoko Hikasa, Arisa Shida, Rie Murakawa, Reina Ueda, Ryosuke Kanemoto, Junko Takeuchi, Noriko Hidaka",Japan,"June 30, 2017",2017,TV-Y7,2 Seasons,"Anime Series, International TV Shows","Akko enrolls at the Luna Nova Witchcraft Academy. She's not the best student, but her bright attitude is the key to her and her friends' success."
s3680,TV Show,Liv and Maddie,,"Dove Cameron, Joey Bragg, Tenzing Norgay Trainor, Kali Rocha, Benjamin King",United States,"April 23, 2017",2017,TV-G,4 Seasons,"Kids' TV, TV Comedies","After four years in Hollywood as a television star, Liv returns to Wisconsin to discover that either she – or her family – has changed."
s3683,TV Show,Live Up To Your Name,,"Kim Nam-gil, Kim Ah-joong, Yoo Min-kyu, Moon Ga-young, Yun Ju-sang, Um Hyo-sup, An Seok-hwan, Lee Dae-yeon, Oh Dae-whan",South Korea,"January 1, 2020",2017,TV-MA,1 Season,"International TV Shows, Korean TV Shows, Romantic TV Shows","Pushed together by twists of time, a Joseon doctor and a cardiac surgeon overcome their 400-year divide as they learn and heal through each other."
s3691,TV Show,Lo que la verdad esconde: El caso Asunta (Operacion Nenúfar),,,Spain,"February 1, 2019",2017,TV-14,1 Season,"Crime TV Shows, Docuseries, International TV Shows","This true crime series investigates newfound evidence and unanswered questions in famous criminal cases, such as the murder of Asunta Basterra Porto."
s3693,TV Show,Loaded,,"Jim Howick, Samuel Anderson, Jonny Sweet, Nick Helm, Mary McCormack, Aimee-Ffion Edwards, Lolly Adefope",United Kingdom,"April 1, 2018",2017,TV-MA,1 Season,"British TV Shows, International TV Shows, TV Comedies",Four friends become overnight millionaires after selling their video game start-up. But their newfound status tests their friendship and resolve.
s3702,Movie,Loco Love,"Fernando Sariñana, José Luis Gutiérrez","Evan Deverian, Melany Bennet, Jordan T. Wilson, Adan Martín Rocha",Mexico,"July 30, 2017",2017,TV-MA,103 min,"Dramas, Independent Movies, International Movies",A young man and woman fall in love but are threatened to be torn apart by the tensions between their Latino and Caucasian communities in Arizona.
s3709,Movie,Lommbock,Christian Zübert,"Lucas Gregorowicz, Moritz Bleibtreu, Louis Hofmann, Wotan Wilke Möhring, Alexandra Neldel, Melanie Winigir, Mavie Hörbiger, Dar Salim, Elmar Wepper, Antoine Monot Jr.",Germany,"November 9, 2018",2017,TV-MA,106 min,"Comedies, International Movies","After finding love in drug-free Dubai, Stefan returns to Germany to grab documents for his wedding. But old buddy Kai's bad habits complicate things."
s3710,Movie,London Heist,Mark McQueen,"Craig Fairbrass, James Cosmo, Mem Ferda, Nick Moran, Steven Berkoff, Nathalie Cox, Roland Manookian, Eddie Webber, Tony Denham, Katie Clarkson-Hill",United Kingdom,"January 1, 2021",2017,R,96 min,Action & Adventure,"After a heist gone wrong, a career criminal gradually uncovers the hidden motive behind his father's murder – and it has nothing to do with money."
s3713,Movie,Long Shot,Jacob LaMendola,,United States,"September 29, 2017",2017,TV-14,40 min,Documentaries,"When Juan Catalan is arrested for a murder he didn't commit, he builds his case for innocence around raw footage from a popular TV show. A documentary."
s3714,Movie,Long Time Running,"Jennifer Baichwal, Nicholas de Pencier","Gord Downie, Paul Langlois, Gord Sinclair, Rob Baker, Johnny Fay, Justin Trudeau",Canada,"November 12, 2017",2017,TV-14,96 min,"Documentaries, International Movies, Music & Musicals",This documentary follows the 2016 tour of beloved rock band The Tragically Hip as they make their way across Canada one last time.
s3715,TV Show,Longmire,,"Robert Taylor, Katee Sackhoff, Lou Diamond Phillips, Bailey Chase, Cassidy Freeman, Adam Bartley, Louanne Stephens",United States,"November 17, 2017",2017,TV-MA,6 Seasons,"Crime TV Shows, TV Dramas",This contemporary crime thriller focuses on a Wyoming sheriff who's rebuilding his life and career following the death of his wife.
s3724,Movie,Los Niños Héroes de Chapultepec,Ignacio López Escrivá,,,"December 15, 2017",2017,TV-14,88 min,"Documentaries, International Movies",This documentary pays tribute to the young cadets who gave their lives to defend Mexico against U.S. forces during the battle of Chapultepec Castle.
s3728,Movie,Losing Sight of Shore,Sarah Moshman,,"United States, Australia, Samoa, United Kingdom","May 1, 2017",2017,TV-14,92 min,"Documentaries, Sports Movies","This documentary recounts the feats of the Coxless Crew, a team of four women who rowed from San Francisco to Australia in support of two charities."
s3733,Movie,Lost in London,Sunkanmi Adebayo,"Ime Bishop Umoh, Alexx Ekubo, Stanley Chibunna, Ella Betts, Adi Lev, Kemi Olofinmakin",Nigeria,"December 21, 2019",2017,TV-PG,86 min,"Comedies, International Movies","Nigerian students Okon and Bona experience culture shock – several shocks, really – after being selected for an exchange program in London."
s3737,Movie,Louis C.K. 2017,Louis C.K.,Louis C.K.,United States,"April 4, 2017",2017,,74 min,Movies,"Louis C.K. muses on religion, eternal love, giving dogs drugs, email fights, teachers and more in a live performance from Washington, D.C."
s3747,TV Show,Love and Hong Kong,,"Eiko Koike, Ryo Yoshizawa, Fumika Baba, Moga Mogami, Tomo Yanagishita, Kaoru Nagata, Ryo Iwamatsu",Japan,"January 20, 2018",2017,TV-PG,1 Season,"International TV Shows, Romantic TV Shows, TV Dramas",The lives of five strangers become intertwined forever when a starlet filming a documentary is kidnapped on the streets of Hong Kong.
s3748,Movie,Love and Shukla,Jatla Siddartha,"Saharsh Kumar Shukla, Taneea Rajawat, Hima Singh, Aparna Upadhyay, Loknath Tiwari, Sambhaji Sasane",India,"September 1, 2018",2017,TV-MA,110 min,"Dramas, Independent Movies, International Movies","A sexually inexperienced rickshaw driver struggles to build intimacy with his shy new wife in their tiny, overcrowded quarters."
s3768,Movie,Love Ni Bhavai,Saandeep Patel,"Malhar Thakar, Pratik Gandhi, Aarohi Patel, Maulik Jagdish Nayak, Diana Raval, Roopa Divatia, Aarti Patel",India,"May 1, 2018",2017,TV-14,163 min,"Comedies, International Movies, Romantic Movies","Not romantically inclined, a popular radio personality finds herself caught between two diametrically opposed suitors."
s3771,Movie,Love Off the Cuff,Pang Ho-cheung,"Miriam Chin Wah Yeung, Shawn Yue, Paul Chun, Jiang Mengjie, Wang Xiao Chen, Siu Yam Yam, Kwok Cheung Tsang, Toby Lee, Dada Chan, Hugo Ng","China, Hong Kong","January 31, 2019",2017,TV-MA,120 min,"Comedies, Dramas, International Movies",Cherie and Jimmy's relationship is in a rut – until Cherie's estranged father shows up and a woman from Jimmy's past shows up with a hidden agenda.
s3781,Movie,Love You to the Stars and Back,Antoinette Jadaone,"Julia Barretto, Joshua Garcia, Carmina Villaroel, Cherry Pie Picache, Ariel Rivera, Maricar Reyes, Edgar Allan Guzman, Jelson Bay, Odette Khan",Philippines,"December 17, 2020",2017,TV-14,111 min,"Comedies, International Movies, Romantic Movies","In search of aliens, a young woman's road trip becomes an emotional journey when she finds — and falls for — a charming companion with cancer."
s3788,Movie,"Love, Surreal and Odd",Yılmaz Erdoğan,"Aylin Kontante, Bülent Emrah Parlak, Büşra Pekin, Çağlar Çorumlu, Fatih Artman, Gupse Özay, Serkan Keskin, Şebnem Bozoklu",Turkey,"October 18, 2019",2017,TV-14,95 min,"Comedies, International Movies, Romantic Movies","When a group of people meets at the same party, they form four different relationships, each experiencing similar phases of love."
s3789,Movie,Love.com,Anita Barbosa,"Isis Valverde, Gil Coelho, Joaquim Lopes, Carol Portes, Alexandra Richter, Marcos Mion, João Côrtes, César Cardadeiro",Brazil,"June 1, 2017",2017,TV-MA,92 min,"Comedies, International Movies, Romantic Movies","When a fashion blogger falls for a video game vlogger, their romance goes viral. But separating their virtual life from reality gets complicated."
s3799,Movie,Lu Over the Wall,Masaaki Yuasa,"Kanon Tani, Shota Shimoda, Shinichi Shinohara, Akira Emoto, Soma Saito, Minako Kotobuki, Daigo, Nobu",Japan,"March 18, 2020",2017,PG,113 min,"Anime Features, Music & Musicals, Sci-Fi & Fantasy",Middle schooler Kai's depressing life in a boring fishing village changes drastically when a local mermaid named Lu joins his band.
s3800,Movie,Lucas Brothers: On Drugs,Jay Chapman,"Keith Lucas, Kenny Lucas",United States,"April 18, 2017",2017,TV-MA,50 min,Stand-Up Comedy,"Deadpan twin comics Keith and Kenny Lucas take the stage in Brooklyn with a set that touches on drugs, race, Deion Sanders, teachers and O.J. Simpson."
s3807,Movie,Lucid Dream,Jun-seong Kim,"Ko Soo, Kyung-gu Seol, Yu-chun Park, Hye-jung Kang, In-hwan Park, Ho-jin Chun",South Korea,"June 2, 2017",2017,TV-MA,102 min,"International Movies, Sci-Fi & Fantasy, Thrillers","After searching for his abducted son for three years, a devastated father attempts to track down his missing child through lucid dreams."
s3811,Movie,Lucknow Central,Ranjit Tiwari,"Farhan Akhtar, Diana Penty, Ronit Roy, Gippy Grewal, Deepak Dobriyal, Inaamulhaq, Rajesh Sharma",India,"October 16, 2017",2017,TV-14,144 min,"Dramas, International Movies, Music & Musicals","After being arrested for a crime he didn't commit, an aspiring musician teams up with some of his inmates at Lucknow Central to form a band."
s3819,TV Show,Luna Petunia,,"Ciara Alexys, Katie Griffin, Cory Doran, Jonah Wineberg",United States,"November 17, 2017",2017,TV-Y,3 Seasons,Kids' TV,"With help from her magic toy chest, fun-loving Luna Petunia enters the fantastic land of Amazia, where adventures, friendship and learning await."
s3829,Movie,Lynne Koplitz: Hormonal Beast,Marcus Raboy,Lynne Koplitz,United States,"August 22, 2017",2017,TV-MA,51 min,Stand-Up Comedy,"Unabashed comedian Lynne Koplitz offers a woman's take on being crazy, the benefits of childlessness and the three things all men really want."
s3830,Movie,Ma Chu Ka,Jayan Vannery,"Pasupathy, Janani Iyer, Pratap Pothen",India,"July 1, 2018",2017,TV-14,117 min,"International Movies, Thrillers",The relationship between a journalist and a lawyer she meets while investigating a story grows complicated as she uncovers layers of deception.
s3833,Movie,Maacher Jhol,Pratim D. Gupta,"Ritwick Chakraborty, Mamata Shankar, Paoli Dam, Kaya Blocksage, Sauraseni Maitra, Arjun Chakrabarty","India, France","January 1, 2018",2017,TV-PG,107 min,"Dramas, International Movies","On his first visit to his home city of Kolkata in 13 years, a Paris-based chef is faced with a cooking challenge that will change his life forever."
s3846,Movie,Maddman: The Steve Madden Story,Ben Patterson,Steve Madden,United States,"January 1, 2018",2017,TV-MA,78 min,Documentaries,This documentary chronicles the rise of the footwear designer behind a billion-dollar empire and his subsequent comeback after a financial scandal.
s3852,TV Show,Maggie & Bianca: Fashion Friends,Iginio Straffi,"Emanuela Rei, Giorgia Boni, Sergio Ruggeri, Luca Murphy, Federica Corti, Federico Pedroni, Tiffany Zhou, Sergio Melone",Italy,"March 31, 2019",2017,TV-Y7,1 Season,"Kids' TV, TV Comedies","Originally polar opposites, an American fashion student and the daughter of an industry mogul form an everlasting bond and start a rock band in Milan."
s3867,Movie,Mahi NRI,Gaurav Bavdankar,"Harrdy Sandhu, Poppy Jabbal, Rameet Kaur, B.N. Sharma, Navneet Nishan, Gurpreet Guggi, Anjum Batra, Ranjan Sehgal",United Kingdom,"December 1, 2019",2017,TV-14,134 min,"Comedies, Dramas, International Movies","A Punjabi man attempts to build a life in London in hopes of impressing his girlfriend’s mother, who insists her daughter marry a man outside of India."
s3883,Movie,Mala Kahich Problem Nahi,Sameer Vidwans,"Gashmeer Mahajani, Spruha Joshi, Nirmiti Sawant, Vijay Nikam, Satish Alekar, Mangal Kenkre, Kamlesh Sawant, Seema Deshmukh",India,"November 15, 2018",2017,TV-PG,132 min,"Dramas, International Movies","With their relationship running on autopilot, a discontent husband and wife must confront their issues while on a trip with the extended family."
s3894,TV Show,Man Down,,"Greg Davies, Roisin Conaty, Jeany Spark, Gwyneth Powell, Isy Suttie, Michael Wozniak, Elliot Levey, Ruth Bratt, Deirdre Mullins, Steven Berkoff, Stella Gonet, Rik Mayall, Ashley McGuire, Stephanie Cole",United Kingdom,"November 30, 2017",2017,TV-MA,4 Seasons,"British TV Shows, TV Comedies","A childish idiot trapped in an adult's body, schoolteacher Dan hates his job, hates his girlfriend-less life and has good reason to fear his dad."
s3897,TV Show,Man to Man,Chang-Min Lee,"Hae-Jin Park, Sung-woong Park, Min-jung Kim, Jung-an Chae, Jung-hoon Yeon, Hyun-sung Jang, Man-sik Jung, Shin-il Kang, Ho-jin Chun, In-ho Tae",South Korea,"June 10, 2017",2017,TV-14,1 Season,"Crime TV Shows, International TV Shows, Korean TV Shows","Disguised as a bodyguard, a special agent must complete his national secret tasks while pandering to the whims of his ill-tempered world star."
s3902,Movie,Mandobasar Galpo,Tathagata Banerjee,"Paoli Dam, Parambrata Chattopadhyay, Indrasish Roy, Koushik Sen, Biswajit Chakraborty",India,"April 1, 2018",2017,TV-14,103 min,"Dramas, International Movies, Romantic Movies","With the assistance of a psychiatrist, an acclaimed filmmaker struggles to come to terms with a mysterious romantic trauma."
s3906,Movie,Manhunt,John Woo,"Zhang Hanyu, Masaharu Fukuyama, Qi Wei, Ji-won Ha, Jun Kunimura, Angeles Woo, Nanami Sakuraba","China, Hong Kong","May 4, 2018",2017,TV-MA,109 min,"Action & Adventure, International Movies",A Chinese pharmaceutical lawyer framed for a vile crime teams up with a sharp-witted Japanese detective to stop a dangerous corporate plot.
s3910,Movie,Manje Bistre,Baljit Singh Deo,"Gippy Grewal, Sonam Bajwa, Karamjit Anmol, Jaggi Singh, B.N. Sharma, Hobby Dhaliwal, Rana Ranbir, Sardar Sohi, Anita Devgan, Harby Sangha",India,"October 1, 2018",2017,TV-14,136 min,"Comedies, Dramas, International Movies","While prepping for a family wedding, a young man falls for his sister’s friend, who has already been promised to someone else."
s3914,Movie,Manolo: The Boy Who Made Shoes for Lizards,Michael Roberts,"Manolo Blahnik, Anna Wintour, André Leon Talley, Paloma Picasso, Candace Bushnell, Iman, Rihanna, Naomi Campbell, Isaac Mizrahi, Rupert Everett, Sofia Coppola, John Galliano",United Kingdom,"January 15, 2018",2017,TV-MA,89 min,"Documentaries, International Movies","As legendary shoe designer Manolo Blahnik speaks about his creative process, his celebrity admirers chime in with their own takes on his work."
s3920,Movie,Mantostaan,Rahat Kazmi,"Raghuvir Yadav, Veerendra Saxena, Sonal Sehgal, Aaditya Pratap Singh, Rahat Kazmi, Raina Bassnet, Sakshi Bhat",India,"December 15, 2017",2017,TV-MA,75 min,"Dramas, Independent Movies, International Movies",Four stories by writer Sadaat Hasan Manto culminate in a single gruesome drama that's set during the partitioning of the Indian subcontinent.
s3921,Movie,Mantra,Nicholas Kharkongor,"Rajat Kapoor, Lushin Dubey, Kalki Koechlin, Shiv Pandit, Adil Hussain, Rohan Joshi, Yuri Suri, Maya Krishna Rao",India,"December 15, 2017",2017,TV-14,89 min,"Dramas, Independent Movies, International Movies",An Indian business owner struggles to keep his company afloat amid global competition while trying to make up for lost time with his family.
s3923,Movie,Manusangada,Amshan Kumar,"Rajeev Anand, Manimegalai, A.S. Sasi Kumar, Vidhur Rajarajan, Sheela Rajkumar, Sethu Darwin, Anand Sampath, Karuna Prasad",India,"February 2, 2019",2017,TV-14,93 min,"Dramas, Independent Movies, International Movies","When caste discrimination prevents a villager from giving his deceased father a rightful burial, he takes his fight for equality to court."
s3925,TV Show,Mar de Plástico,,"Rodolfo Sancho, Belén López, Pedro Casablanc, Luis Fernández, Patrick Criado, Nya de la Rubia, Jesús Castro, Fernando Cayo",Spain,"April 27, 2017",2017,TV-MA,2 Seasons,"Crime TV Shows, International TV Shows, Spanish-Language TV Shows","In a town in southern Spain where racial tensions run high among the workers in its many greenhouses, a cop investigates the murder of a young woman."
s3926,Movie,Mara,Clive Tonge,"Olga Kurylenko, Javier Botet, Mitch Eakins, Lance E. Nichols, Rosie Fellner, Mackenzie Imsand, Dandy Barrett, Craig Conway, Melissa Bolona",United Kingdom,"January 5, 2019",2017,TV-MA,99 min,"Horror Movies, Thrillers","When criminal psychologist Kate Fuller investigates a man who was seemingly murdered in his sleep by his wife, she uncovers a case like no other."
s3931,Movie,Marc Maron: Too Real,Lynn Shelton,Marc Maron,United States,"September 5, 2017",2017,TV-MA,70 min,Stand-Up Comedy,"Battle-scarred stand-up comedian Marc Maron unleashes a storm of ideas about meditation, mortality, documentary films and our weird modern world."
s3933,TV Show,March Comes in Like a Lion,,"Kengo Kawanishi, Ai Kayano, Kana Hanazawa, Misaki Kuno, Nobuhiko Okamoto, Marina Inoue, Yoshimasa Hosoya, Shinichiro Miki, Tomokazu Sugita, Subaru Kimura, Shigeru Chiba, Toru Okawa, Takahiro Sakurai",Japan,"June 1, 2019",2017,TV-14,2 Seasons,"Anime Series, International TV Shows, Teen TV Shows","Orphaned young, a reclusive 17-year-old professional shogi player starts to come out of his shell when three sisters take him under their wing."
s3935,Movie,Marco Luque: Tamo Junto,Caio Cobra,Marco Luque,Brazil,"June 15, 2017",2017,TV-MA,73 min,Stand-Up Comedy,"Eclectic character comedian Marco Luque plays himself in this stand-up special about relationships, regional differences and his own love of movies."
s3939,Movie,Maria Bamford: Old Baby,Jessica Yu,Maria Bamford,United States,"May 2, 2017",2017,TV-MA,64 min,Stand-Up Comedy,"Maria Bamford performs a rapid-fire, playful stand-up set for crowds at park benches, bowling alleys and LA theaters in this roving comedy special."
s3956,Movie,Martin Luther: The Idea that Changed the World,David Batty,Hugh Bonneville,United States,"January 1, 2018",2017,TV-PG,55 min,"Documentaries, Faith & Spirituality","This docudrama tells the dramatic story of the monk who took on the Catholic Church, tracing his life before and after the contentious ""95 Theses."""
s3970,TV Show,Marvel's The Defenders,,"Charlie Cox, Krysten Ritter, Mike Colter, Finn Jones, Sigourney Weaver, Elodie Yung, Elden Henson, Jessica Henwick, Simone Missick, Rachael Taylor, Deborah Ann Woll, Rosario Dawson, Carrie-Anne Moss, Eka Darville, Scott Glenn",United States,"August 18, 2017",2017,TV-MA,1 Season,"Crime TV Shows, TV Action & Adventure, TV Dramas","Daredevil, Jessica Jones, Luke Cage and Iron Fist join forces to take on common enemies as a sinister conspiracy threatens New York City."
s3972,Movie,Mary and the Witch's Flower,Hiromasa Yonebayashi,"Ruby Barnhill, Kate Winslet, Jim Broadbent, Ewen Bremner, Lynda Baron, Louis Ashbourne Serkis, Morwenna Banks, Teresa Gallagher, Rasmus Hardiker",Japan,"July 17, 2018",2017,PG,103 min,"Anime Features, Children & Family Movies","Ordinary girl Mary picks an extraordinary flower and travels to Endor College, a school for magic. But its foremost teachers have a sinister plan."
s3986,TV Show,Master of None,,"Aziz Ansari, Noël Wells, Eric Wareheim, Lena Waithe, Kelvin Yu, Fatima Ansari, Shoukath Ansari, Alessandra Mastronardi, Bobby Cannavale",United States,"May 12, 2017",2017,TV-MA,2 Seasons,TV Comedies,Dev tries to jump-start his acting career and elevate his dating game with help from his eclectic group of friends in this award-winning series.
s3988,Movie,Match,Obaid Alhmoudi,"Mahmood Bin Shamsan, Waleed Alyasi, Sawsan Saad",,"May 14, 2020",2017,TV-14,91 min,"Dramas, International Movies","After living with a criminal father, two brothers on different paths head for a direct collision when an intriguing woman enters both of their lives."
s3989,Movie,Mater,Pablo D'Alo Abba,"Lautaro Perotti, Tamara Kiper, Inda Lavalle, Miriam Odorico, Araceli Dvoskin, Gonzalo Ruiz, Patricio Aranguren, Marina Bellati, Luciana Fuks, Martin Slipak",Argentina,"August 1, 2018",2017,TV-MA,80 min,"Dramas, Independent Movies, International Movies",A single man in his 30s overwhelmed by his domineering mother meets a lesbian couple willing to go to extreme lengths to have a child.
s3998,Movie,May You Prosper,"Hassan Hegazy, Shady Ali","Ahmed Rizk, Bosy, Bayoumi Fouad, Mahmoud Ellithy, Hayatem, Hesham Ismail, Tamer Shaltout, Alaa Morsy",Egypt,"July 20, 2019",2017,TV-14,93 min,"Comedies, International Movies, Music & Musicals","A man's inability to conquer his personal insecurities and distrust of other people leads to problems with his on-again, off-again wife and their son."
s4002,Movie,Maynard,Samuel D. Pollard,,United States,"September 2, 2018",2017,TV-PG,100 min,Documentaries,"Friends, family and political titans recall the impact of Atlanta's Maynard Jackson, the first African-American mayor of a major Southern city."
s4003,Movie,Maz Jobrani: Immigrant,Maz Jobrani,Maz Jobrani,,"August 1, 2017",2017,TV-14,67 min,Stand-Up Comedy,"Iranian American comic Maz Jobrani lights up the Kennedy Center with riffs on immigrant life in the Trump era, modern parenting pitfalls and more."
s4006,Movie,Mea Culpa,"Raúl Campos, Jan Suter",Alexis de Anda,Mexico,"November 10, 2017",2017,TV-MA,54 min,Stand-Up Comedy,"Raw and outspoken, comedian Alexis de Anda bares her soul about weddings, exercise, sex, gynecologists, drugs and much more in this stand-up special."
s4014,Movie,Meditation Park,Mina Shum,"Cheng Pei-pei, Tzi Ma, Sandra Oh, Don McKellar, Zak Santiago, Liane Balaban, Alannah Ong, Lillian Lim, Jemmy Chen",Canada,"March 9, 2018",2017,TV-PG,94 min,Dramas,An elderly immigrant matriarch from Hong Kong finally begins to break out of her shell of isolation when she suspects her husband of infidelity.
s4017,Movie,Meet the In-Laws,Niyi Akinmolayan,"Adeniyi Johnson, Tina Mba, Dele Odule, Lilian Esoro, Amaechi Muonagor, Blessing Onwukwe, Dayo Amusa, Kenneth Okolie",Nigeria,"August 18, 2020",2017,TV-PG,75 min,"Comedies, Dramas, International Movies","When their respective parents oppose their union, a newly engaged couple learns that the reasons for pushback run deeper than just tribal differences."
s4018,Movie,Meet the Trumps: From Immigrant to President,"Paul Berczeller, Mark Radice",,United Kingdom,"October 25, 2017",2017,TV-14,48 min,Documentaries,"Learn about Donald Trump's family history, including his immigrant grandfather's gold-rush enterprises and his dad's development of a property empire."
s4022,Movie,Meghnadbodh Rohoshyo,Anik Datta,"Barun Chanda, Sabyasachi Chakraborty",India,"October 15, 2018",2017,TV-MA,150 min,"Dramas, International Movies","A professor mysteriously vanishes, leaving behind a host of suspects, a shadowy history and a clue: the anonymous birthday gift of a Bengali classic."
s4024,Movie,Melle,Binu Ulahhannan,"Amith Chakalakkal, Thanuja Karthik, Joy Mathew, Joju George, Krishna Prabha, Ambika Mohan, P. Balachandran, Illikkett Namboothiri",India,"August 1, 2018",2017,TV-PG,110 min,"Dramas, International Movies, Romantic Movies","After recovering from a tragic experience, a young woman makes a journey to her father's homeland and falls in love with a kind-hearted doctor."
s4027,Movie,Memoir of a Murderer,Shin-yeon Won,"Kyung-gu Seol, Nam-gil Kim, Seol-hyun Kim, Dal-su Oh, Seok-jeong Hwang, In-Gum Jung, Ki-jun Shin, Jin-young Jang, Rina Shin, Hye-yoon Kim",South Korea,"February 19, 2018",2017,TV-MA,118 min,"Dramas, International Movies, Thrillers","Hiding his own murderous past, a man suffering from Alzheimer's must protect his daughter from her boyfriend, who he suspects is also a serial killer."
s4031,TV Show,Memory Love,,"Andy Chen, Mandy Wei, Jolin Chien, Mandy Tao, Kris Shen, Nylon Chen",,"January 18, 2019",2017,TV-14,1 Season,"International TV Shows, Romantic TV Shows, TV Dramas","Losing her memory – and her boyfriend – after a car accident, Jia-en crosses paths with a heart transplant recipient who helps her recall her past."
s4036,Movie,Menashe,"Josh Z. Weinstein, Joshua Z. Weinstein","Menashe Lustig, Ruben Niborski, Yoel Weisshaus, Meyer Schwartz, Yoel Falkowitz, Ariel Vaysman",United States,"January 25, 2020",2017,PG,82 min,"Dramas, Independent Movies","A year after his wife's death, a widower faces pressure from his Hasidic community to give up his son for adoption unless he finds a new partner."
