show_id,type,title,director,cast,country,date_added,release_year,rating,duration,listed_in,description
s4102,Movie,Milk,Gus Van Sant,"Sean Penn, Emile Hirsch, Josh Brolin, Diego Luna, James Franco, Alison Pill, Victor Garber, Denis O'Hare, Joseph Cross, Stephen Spinella, Lucas Grabeel, Brandon Boyce",United States,"February 16, 2017",2008,R,128 min,"Dramas, Independent Movies, LGBTQ Movies","Sean Penn stars in this biopic about Harvey Milk, the openly gay San Francisco politician who was murdered by a disgruntled city supervisor in 1978."
s4150,Movie,Mission Istaanbul: Darr Ke Aagey Jeet Hai,Apoorva Lakhia,"Vivek Oberoi, Zayed Khan, Shriya Saran, Nikitin Dheer, Shabbir Ahluwalia, Sunil Shetty, Shweta Bhardwaj",India,"May 16, 2019",2008,TV-MA,119 min,"Action & Adventure, International Movies, Music & Musicals",A television journalist makes a risky career move by accepting a job offer from a controversial Istanbul television station.
s4210,Movie,Monty Python Conquers America,Will Yapp,"Graham Chapman, Eric Idle, Terry Jones, Michael Palin, Terry Gilliam, John Cleese",,"October 2, 2018",2008,TV-MA,55 min,Documentaries,Follow the evolution of the British sketch comedy troupe that redefined humor and shaped an entire generation of American comics.
s4280,Movie,Mumbai Meri Jaan,Nishikant Kamat,"Madhavan, Irrfan Khan, Soha Ali Khan, Paresh Rawal, Kay Kay Menon, Anand Goradia, Vijay Maurya, Vibhavari Deshpande, Santosh Juvekar, Kamlesh Sawant",India,"November 1, 2018",2008,TV-MA,135 min,"Dramas, International Movies","A moving portrayal of the 2006 train bombings in Mumbai, this Indian drama follows the interconnected stories of several strangers."
s4357,Movie,My Sleeping Lover,Ahmad El-Badri,"Mai Ezz El-Din, Khaled Abol Naga, Hassan Hosny, Marwa Abdel Monem, Moustafa Haridy, Nahla Zaki, Ezzat Abou Aouf, Reda Hamed, Muhammad Qishta",Egypt,"May 19, 2020",2008,TV-PG,93 min,"Comedies, International Movies","After undergoing hypnosis, Ramez finally meets the woman of his dreams — but his vision of her appearance doesn't quite match up with reality."
s4406,Movie,Naruto Shippûden the Movie: Bonds,Hajime Kamegaki,"Junko Takeuchi, Noriaki Sugiyama, Chie Nakamura, Kazuhiko Inoue, Satoshi Hino, Shinji Kawada, Nana Mizuki, Showtaro Morikubo, Rikiya Koyama, Motoko Kumai, Unsho Ishizuka",Japan,"October 15, 2016",2008,TV-PG,93 min,"Action & Adventure, Anime Features, International Movies","When strange ninjas ambush the village of Konohagakure, it's up to adolescent ninja Naruto and his long-missing pal, Sasuke, to save the planet."
s4474,Movie,Nights in Rodanthe,George C. Wolfe,"Richard Gere, Diane Lane, Christopher Meloni, Viola Davis, Becky Ann Baker, Scott Glenn, Linda Molloy, Pablo Schreiber, Mae Whitman, Charlie Tahan","United States, Australia","July 1, 2019",2008,PG-13,97 min,"Dramas, Romantic Movies","When a hurricane hits a coastal North Carolina inn and strands the only guest, surgeon Paul Flanner, a young woman's life changes forever."
s4716,Movie,Oye Lucky! Lucky Oye!,Dibakar Banerjee,"Abhay Deol, Paresh Rawal, Neetu Chandra, Archana Puran Singh, Manu Rishi Chadha, Richa Chadda, Anurag Arora, Rajender Sethi, Manjot Singh, Chandan Anand",India,"November 1, 2018",2008,TV-14,118 min,"Comedies, Dramas, International Movies","Starting as a petty thief, a man rises to become one of the city's biggest operators and carves out the kind of lifestyle he'd once only dreamed of."
s4862,Movie,Pineapple Express,David Gordon Green,"Seth Rogen, James Franco, Danny McBride, Kevin Corrigan, Craig Robinson, Gary Cole, Rosie Perez, Ed Begley Jr., Nora Dunn, Amber Heard",United States,"September 1, 2020",2008,R,112 min,"Action & Adventure, Comedies","After witnessing a murder, a perpetually stoned process server and his good-natured dealer go on the run from a drug lord who's out to kill them."
s4890,Movie,Pocoyo & The Space Circus,Alfonso Rodríguez,"Stephen Fry, Carys Doyle",Spain,"May 1, 2018",2008,TV-Y,25 min,Movies,"Acrobatic aliens arrive on spaceships and perform for everyone, but when angry aliens arrive as well, Pocoyo and his friends must now put on a show."
s4933,TV Show,Power Rangers Jungle Fury,,"Jason Smith, Aljin Abella, Anna Hutchison, David de Lautour, Nikolai Nikolaeff, Sarah Thomson, Bede Skinner, Holly Shanahan, Kelson Henderson, Richard Simpson, Cameron Rhodes, Elisabeth Easther, Mark Wright, Derek Judge",United States,"January 1, 2016",2008,TV-Y7,1 Season,Kids' TV,The Power Rangers travel to California in search of their new master and find him running a pizza parlor – so they join the staff to be trained.
s4990,Movie,Prom Night,Nelson McCormick,"Brittany Snow, Scott Porter, Jessica Stroup, Dana Davis, Collins Pennie, Kelly Blatz, James Ransone, Brianne Davis, Kellan Lutz, Mary Mara, Ming-Na Wen, Johnathon Schaech, Idris Elba","United States, Canada","November 12, 2020",2008,PG-13,88 min,Horror Movies,"On prom night, a high school senior still struggling with her nightmare past tries to evade a killer bent on ending the party for her and her friends."
s5029,Movie,Quantum of Solace,Marc Forster,"Daniel Craig, Olga Kurylenko, Mathieu Amalric, Judi Dench, Giancarlo Giannini, Gemma Arterton, Jeffrey Wright, David Harbour, Jesper Christensen, Anatole Taubman","United Kingdom, United States","August 31, 2020",2008,PG-13,106 min,Action & Adventure,"Picking up an hour after the events of 2006's Casino Royale, this James Bond adventure finds 007 tracking a traitor who's infiltrated Britain's MI6."
s5047,Movie,R.L. Stine's Mostly Ghostly,Richard Correll,"Madison Pettis, Sterling Beaumon, Luke Benward, Brian Stepanek, David DeLuise, Kim Rhodes, Adam Hicks, Ali Lohan, Sabrina Bryan, Rachel Winfree, Diego Acuña",United States,"August 1, 2018",2008,PG,98 min,"Children & Family Movies, Comedies","After discovering a pair of young ghosts, a nebbish 11-year-old agrees to help the sibling spirits solve the mystery surrounding their demise."
s5053,Movie,Race,"Mastan Alibhai Burmawalla, Abbas Alibhai Burmawalla","Saif Ali Khan, Akshaye Khanna, Katrina Kaif, Bipasha Basu, Anil Kapoor, Sameera Reddy",India,"October 1, 2018",2008,TV-14,155 min,"Action & Adventure, International Movies, Music & Musicals",The plot thickens around two horse-racing competitors when three beautiful women come into their lives and a murder is committed.
s5056,Movie,Rachel Getting Married,Jonathan Demme,"Anne Hathaway, Rosemarie DeWitt, Debra Winger, Bill Irwin, Tunde Adebimpe, Mather Zickel, Anna Deavere Smith, Anisa George, Robyn Hitchcock, Sister Carol East, Sebastian Stan",United States,"September 1, 2019",2008,R,113 min,"Dramas, Independent Movies",Longstanding family conflicts resurface when a former model who's been in and out of rehab for a decade returns home for her sister's wedding.
s5116,Movie,Real Crime: Diamond Geezers,Tom Whitter,Forbes KB,United Kingdom,"August 1, 2016",2008,TV-14,46 min,Documentaries,"In an attempted heist worthy of a Hollywood film, a cadre of criminals sets out to steal the world's largest perfect diamond from a London landmark."
s5189,Movie,Revolutionary Road,Sam Mendes,"Leonardo DiCaprio, Kate Winslet, Kathy Bates, Michael Shannon, Kathryn Hahn, David Harbour, Dylan Baker, Richard Easton, Zoe Kazan, Jay O. Sanders, Max Casella","United States, United Kingdom","November 1, 2019",2008,R,120 min,"Dramas, Romantic Movies","April and Frank's marriage unravels when a plan to change their ""perfect"" lives becomes their last hope to escape lives engulfed in emptiness."
s5208,Movie,Righteous Kill,Jon Avnet,"Robert De Niro, Al Pacino, 50 Cent, Carla Gugino, John Leguizamo, Donnie Wahlberg, Brian Dennehy, Trilby Glover",United States,"June 1, 2019",2008,R,101 min,"Dramas, Thrillers","Two detectives investigate a rash of vigilante killings linked to an old case, suggesting they might have put an innocent man behind bars."
s5243,Movie,Rock On!!,Abhishek Kapoor,"Farhan Akhtar, Arjun Rampal, Purab Kohli, Luke Kenny, Prachi Desai, Shahana Goswami, Koel Purie",India,"December 15, 2019",2008,TV-14,139 min,"Dramas, International Movies, Music & Musicals","Four friends hoped that their rock band would be a hit. After breaking up, the band members reunite and take another shot at fulfilling their dream."
s5373,Movie,Sanai Choughade,Rajeev Patil,"Shreyas Talpade, Subodh Bhave, Sai Tamhankar, Santosh Juvekar, Tushar Dalvi, Bharti Aacharekar",India,"January 1, 2018",2008,TV-14,122 min,"Comedies, Dramas, International Movies","In an effort to honor the family matriarch's dying wish, Urmila and her husband, Shrikant, embark on a quest to find a husband for charismatic yet choosey Sai. But some things are easier said than done."
s5401,Movie,Sat Sri Akal,Kamal Sahani,"Kimi Verma, Manpreet Singh, Arun Bali, Dolly Minhas, Avtar Gill, Manmeet Singh, Neelu Kohli, Vivek Shaq, Nirmal Rishi, Pooja Tandon",India,"January 30, 2019",2008,TV-14,141 min,"Dramas, Faith & Spirituality, International Movies","Based on true events, this moving story centers on a Punjabi family whose celebration of their faith endures in the face of conflicting attitudes."
s5505,Movie,Set Off,Liu Jiang,"Wenpei Ju, Fan Wei, Liu Hua, Qianyuan Wang, Ren Zhengbin, He Jiang",China,"December 1, 2018",2008,TV-MA,96 min,"Dramas, International Movies","When a restaurant owner in Cyprus returns to Beijing to sign divorce papers, a drunk woman he encounters triggers a string of mishaps."
s5516,Movie,Seven Pounds,Gabriele Muccino,"Will Smith, Rosario Dawson, Woody Harrelson, Michael Ealy, Barry Pepper, Elpidia Carrillo, Robinne Lee, Joe Nunez, Bill Smitrovich, Tim Kelleher, Gina Hecht, Andy Milder, Judyann Elder, Sarah Jane Morris",United States,"December 1, 2018",2008,PG-13,123 min,"Dramas, Romantic Movies","Weighed down by a dark secret, IRS agent Ben Thomas tries to improve the lives of seven strangers in need of a second chance."
s5522,Movie,Sex and the City: The Movie,Michael Patrick King,"Sarah Jessica Parker, Kim Cattrall, Kristin Davis, Cynthia Nixon, Chris Noth, Candice Bergen, Jennifer Hudson, David Eigenberg, Evan Handler, Jason Lewis, Mario Cantone, Lynn Cohen",United States,"January 1, 2021",2008,R,145 min,"Comedies, Dramas, Romantic Movies","When Carrie's big step forward in her relationship goes awry, best friends Charlotte, Miranda and Samantha are there to help her pick up the pieces."
s5524,Movie,Sex Drive,Sean Anders,"Josh Zuckerman, Amanda Crew, Clark Duke, Seth Green, James Marsden, Michael Cudlitz, Dave Sheridan, Alice Greczyn, Katrina Bowden, Charlie McDermott, Mark L. Young",United States,"September 1, 2020",2008,R,109 min,Comedies,"Eager to hook up with a woman he met online, 18-year-old Ian embarks on an epic road trip that speeds straight toward trouble in this raunchy comedy."
s5549,Movie,Shaurya: It Takes Courage to Make Right... Right,Samar Khan,"Rahul Bose, Javed Jaffrey, Minissha Lamba, Seema Biswas, Deepak Dobriyal, Kay Kay Menon, Amrita Rao, Rosa Catalano, Subrat Dutta, Priyesh Kaushik",India,"March 1, 2018",2008,TV-14,135 min,"Dramas, International Movies",Courtroom intrigue plays out against a backdrop of military secrets in this Bollywood drama with a plot that's reminiscent of A Few Good Men.
s5599,TV Show,Sid the Science Kid,,"Drew Massey, Julianne Buescher, Victor Yerrid, Alice Dinnean, Donna Kimball, John Munro Cameron, Kristin Charney",United States,"March 31, 2020",2008,TV-Y,1 Season,Kids' TV,"Armed with a healthy sense of humor and the help of his teacher, friends and family, curious kid Sid tackles questions youngsters have about science."
s5618,TV Show,Sin senos no hay paraíso,,"Carmen Villalobos, Catherine Siachoque, María Fernanda Yépez, Ramiro Meneses, Juan Diego Sánchez, Aylín Mujica, Fabián Ríos, Roberto Mateos","Colombia, Mexico, United States","May 15, 2017",2008,TV-14,1 Season,"International TV Shows, Spanish-Language TV Shows, TV Dramas","Inspired by a true story, this TV drama shadows a young Colombian woman who goes to shocking lengths to escape a life of poverty."
s5676,Movie,Smart People,Noam Murro,"Dennis Quaid, Sarah Jessica Parker, Thomas Haden Church, Ellen Page, Ashton Holmes, Christine Lahti, Camille Mana, David Denman, Don Wadsworth, Robert Haley",United States,"July 12, 2019",2008,R,95 min,"Comedies, Dramas, Independent Movies",An unexpected romance and a surprise visit from his wild brother turn the life of widowed professor Lawrence Wetherhold upside down.
s5724,Movie,Sorry To Disturb,Khaled Marei,"Ahmed Helmy, Mahmoud Hemeida, Menna Shalaby, Dalal Abdelaziz, Mohamed Sharaf, Tarek El Tilmisany, Mohammed El Sadaany, Samy Maghawry, Ahmed Fouad Selim, Ahmed Ramah",Egypt,"June 2, 2020",2008,TV-14,116 min,"Dramas, International Movies","After losing his father, a genius yet troubled aviation engineer suffering from loneliness tackles a complex project: love."
s5726,TV Show,Soul Eater,,"Chiaki Omigawa, Laura Bailey, Emiri Kato, Kouki Uchiyama, Micah Solusod, Yumiko Kobayashi, Brittney Karbowski, Mamoru Miyano, Todd Haberkorn, Kaori Nazuka, Monica Rial, Akeno Watanabe, Jamie Marchi, Narumi Takahira, Cherami Leigh, Houko Kuwashima",Japan,"January 16, 2020",2008,TV-14,1 Season,"Anime Series, International TV Shows","Maka and the other students at the Death Weapon Meister Academy must kill 99 evil humans and one witch, absorbing their spirits when they die."
s5810,Movie,Step Brothers,Adam McKay,"Will Ferrell, John C. Reilly, Mary Steenburgen, Richard Jenkins, Adam Scott, Kathryn Hahn, Andrea Savage, Lurie Poston, Elizabeth Yozamp, Logan Manus, Rob Riggle",United States,"November 1, 2019",2008,R,98 min,Comedies,"Brennan and Dale might be grown men, but that doesn't stop a childish sibling rivalry from erupting after Brennan's mom marries Dale's dad."
s5958,Movie,Tahaan,Santosh Sivan,"Purav Bhandare, Anupam Kher, Rahul Bose, Victor Banerjee, Ankush Dubey, Rasika Dugal, Rahul Khanna, Sana Shaikh, Dheirya Sonecha, Fatima Sana Shaikh, Sarika",India,"July 15, 2018",2008,TV-14,95 min,"Dramas, International Movies","After his family's donkey is confiscated by a moneylender, 8-year-old Tahaan travels across conflict-torn Kashmir to find his beloved pet."
s6121,Movie,The Beast Stalker,Dante Lam,"Nicholas Tse, Nick Cheung, Zhang Jing-chu, Miao Pu, Liu Kai-chi, Philip Keung, Kwok Jing-hung, Sherman Chung, Zhang He, Wong Suet-yin, Wong Sum-yin",Hong Kong,"July 21, 2019",2008,TV-14,110 min,"Action & Adventure, International Movies","Feeling guilty after a high-speed chase leaves a girl dead, a determined sergeant pursues the crime boss who triggered the fatal car accident."
s6166,Movie,The Boy in the Striped Pajamas,Mark Herman,"Asa Butterfield, Vera Farmiga, David Thewlis, Rupert Friend, David Hayman, Jack Scanlon, Amber Beattie, Sheila Hancock, Richard Johnson, Jim Norton","United Kingdom, United States","January 1, 2019",2008,PG-13,95 min,"Dramas, Independent Movies, International Movies","When his family moves from Berlin to Poland, a young boy befriends a boy who lives on the other side of the fence, unaware he's a Jewish prisoner."
s6365,Movie,The Forbidden Kingdom,Rob Minkoff,"Jackie Chan, Jet Li, Collin Chou, Liu Yifei, Li Bingbing, Michael Angarano, Morgan Benoit, Juana Collignon, Wang Deshun, Thomas McDonell","United States, China","July 1, 2019",2008,PG-13,104 min,"Action & Adventure, Sci-Fi & Fantasy",Jackie Chan and Jet Li star in this rousing adventure about a martial arts movie fan who finds a mystical staff that transports him to ancient China.
s6383,TV Show,The Game,,"Tia Mowry-Hardrict, Pooch Hall, Coby Bell, Wendy Raquel Robinson, Hosea Chanchez, Brittany Daniel, Barry Floyd",United States,"August 15, 2020",2008,TV-14,3 Seasons,"Romantic TV Shows, TV Comedies, TV Dramas",Medical school student Melanie adjusts to life in the world of professional sports when her boyfriend Derwin becomes a pro football player.
s6442,Movie,The Haunting of Molly Hartley,Mickey Liddell,"Haley Bennett, Jake Weber, Chace Crawford, Shannon Woodward, Shanna Collins, AnnaLynne McCord, Marin Hinkle, Nina Siemaszko, Josh Stewart, Jessica Lowndes, Randy Wayne",United States,"October 4, 2018",2008,PG-13,85 min,"Horror Movies, Thrillers","A troubled teenage girl hopes to start fresh at a new school, but the horrifying truth about her past is destined to catch up with her."
s6507,TV Show,The Irish Mob,,Mickey Spillane,,"December 1, 2016",2008,TV-MA,1 Season,"Crime TV Shows, Docuseries","This documentary crime series charts the rise of the Irish Mob in America, from urban immigrant poverty to political power and wealth."
s6583,TV Show,The Legend of Bruce Lee,,"Danny Chan, Michelle Lang, Ted Duran, Hazen MacIntyre, Luoyong Wang, Natalia Dzyublo, Traci Ann Wolfe, Ke Gai, Zhou Zhou, Yu Chenghui",China,"July 7, 2017",2008,TV-14,1 Season,"International TV Shows, TV Action & Adventure, TV Dramas","The brief but spectacular career of martial arts superstar Bruce Lee is recounted in this drama, starring Danny Chan as the enigmatic and driven Lee."
s6615,Movie,The Longshots,Fred Durst,"Ice Cube, Keke Palmer, Tasha Smith, Jill Marie Jones, Dash Mihok, Matt Craven, Glenn Plummer, Garrett Morris, Miles Chandler, Malcolm Goodwin",United States,"January 30, 2019",2008,PG,95 min,"Comedies, Dramas, Sports Movies","When an 11-year-old girl becomes Pop Warner football's first female quarterback, she raises eyebrows – till she takes her team to the brink of glory."
s6623,Movie,The Love Guru,Marco Schnabel,"Mike Myers, Jessica Alba, Justin Timberlake, Ben Kingsley, Romany Malco, Meagan Good, Verne Troyer, Omid Djalili, Telma Hopkins","United Kingdom, Germany, United States","November 20, 2019",2008,PG-13,87 min,"Comedies, Sports Movies","Raised on an ashram in India, a self-styled love guru returns to his native America to settle a romantic rivalry between two pro hockey players."
s6724,Movie,The Only Mother To You All,Wenn V. Deramas,"Ai-Ai de las Alas, Shaina Magdayao, Carlo Aquino, Alwyn Uytingco, Eugene Domingo, Deejay Durano, Serena Dalrymple, Jiro Manio, Yuki Kadooka, Cherry Pie Picache, Gloria Diaz",Philippines,"February 27, 2019",2008,TV-PG,106 min,"Comedies, International Movies","Raising her large family alone after her husband's death, Ina searches for work and finally lands the most unlikely job: president of the Philippines."
s6800,Movie,The Rainbow Troops,Riri Riza,"Cut Mini Theo, Ikranagara, Lukman Sardi, Ario Bayu, Tora Sudiro",Indonesia,"October 21, 2018",2008,TV-PG,119 min,"Children & Family Movies, Dramas, International Movies",Two Indonesian teachers embrace an inspiring crop of gifted young students who've come to study at their crumbling Islamic primary school.
s6893,Movie,The Spiderwick Chronicles,Mark Waters,"Freddie Highmore, Mary-Louise Parker, Sarah Bolger, Joan Plowright, David Strathairn, Nick Nolte, Seth Rogen, Andrew McCarthy, Martin Short",United States,"March 1, 2019",2008,PG,97 min,Children & Family Movies,"When city-raised twins move to a tumbledown country mansion, it's quite an adjustment – especially after they uncover a magical fantasy world."
s6948,TV Show,The Truth,,"Tay Ping Hui, Joanne Peh, Shaun Chen, Rebecca Lim, Zhu Houren, Richard Low",,"November 1, 2017",2008,TV-14,1 Season,"Crime TV Shows, International TV Shows, TV Action & Adventure","A devious businessman covets his partner's priceless treasure map, while a related murder case calls into question some biological family ties."
s7093,Movie,Tim Minchin: So F**king Rock,Matt Askem,Tim Minchin,United Kingdom,"December 31, 2018",2008,TV-MA,127 min,"Music & Musicals, Stand-Up Comedy",Comedic pianist Tim Minchin performs a host of his catchy songs that touch on everything from the Middle East to the healing power of canvas bags.
s7157,TV Show,Toradora!,,"Rie Kugimiya, Junji Majima, Yui Horie, Hirofumi Nojima, Eri Kitamura, Sayaka Ohara, Ai Nonaka, Momoko Ishikawa, Hiroyuki Yoshino, Kazuyuki Okitsu, Rie Tanaka, Yuhko Kaida, Saori Goto",Japan,"August 1, 2020",2008,TV-14,1 Season,"Anime Series, International TV Shows, Romantic TV Shows","Menacing in appearance but gentle at heart, Ryūji forms an unlikely friendship with Taiga, a tiny girl with a sharp tongue and a tough attitude."
s7177,Movie,Trailer Park Boys: Say Goodnight to the Bad Guys,Mike Clattenburg,"John Paul Tremblay, Robb Wells, John Dunsworth, Patrick Roach, Lucy Decoutere, Sarah Dunsworth, Barrie Dunn, Jeanna Harrison, Shelley Thompson, Tyrone Parsons",Canada,"March 1, 2018",2008,TV-MA,47 min,"Comedies, Cult Movies","A year after the Season 7 finale, the boys are poised to live the good life. But an old enemy throws a wrench in things once again."
s7184,Movie,Traitor,Jeffrey Nachmanoff,"Don Cheadle, Guy Pearce, Saïd Taghmaoui, Neal McDonough, Alyy Khan, Archie Panjabi, Raad Rawi, Jeff Daniels, Lorena Gale, Simon Reynolds, Jonathan Walker, Mozhan Marnò, Tom Barnett, Scali Delpeyrat",United States,"July 1, 2018",2008,PG-13,114 min,"Dramas, Thrillers",An FBI agent assigned to pursue an ex-Special Ops soldier who joined a terrorist organization begins to question his target's true intentions.
s7294,Movie,Tyson,James Toback,"Mike Tyson, Trevor Berbick","United States, France","March 1, 2019",2008,R,90 min,"Documentaries, Sports Movies","In this surprisingly emotional documentary, heavyweight champ Mike Tyson analyzes the controversies surrounding his career and turbulent private life."
s7300,Movie,Ugly Aur Pagli,Sachin Kamlakar Khot,"Mallika Sherawat, Ranvir Shorey, Tinnu Anand, Sushmita Mukherjee, Manish Anand, Vihang Nayak, Bharati Achrekar, Zeenat Aman",India,"February 15, 2019",2008,TV-14,115 min,"Comedies, International Movies, Romantic Movies","Everyday guy Kabir is thrown for a loop when he meets Kuhu, a freewheeling party girl. Now, he's a changed man, dancing, running half-naked through the streets and donning ladies' shoes at her whim."
s7388,TV Show,Vampire Knight,,"Daisuke Kishio, Ezra Weisz, Mamoru Miyano, Vic Mignogna, Yui Horie, Mela Lee, Risa Mizuno, Stephanie Sheh, Junichi Suwabe, Troy Baker, Jun Fukuyama, Bryce Papenbrook, Mai Nakahara, Laura Bailey, Soichiro Hoshi, Steve Staley, Susumu Chiba, Spike Spencer, Hiroki Yasumoto, Travis Willingham, Fumiko Orikasa, Wendee Lee",Japan,"October 15, 2016",2008,TV-14,2 Seasons,"Anime Series, International TV Shows, Romantic TV Shows","At Cross Academy, two student disciplinary committee members are tasked with keeping the peace between a human class and a night class of vampires."
s7393,Movie,Vantage Point,Pete Travis,"Dennis Quaid, Matthew Fox, Forest Whitaker, Bruce McGill, Edgar Ramírez, Saïd Taghmaoui, Ayelet Zurer, Zoe Saldana, Sigourney Weaver, William Hurt",United States,"November 1, 2019",2008,PG-13,90 min,Action & Adventure,"Moments after he arrives in Spain for an antiterrorism summit, U.S. President Ashton is shot."
s7408,Movie,Verses of Love,Hanung Bramantyo,"Fedi Nuril, Rianti Cartwright, Carissa Putri, Melanie Putria, Zaskia Adya Mecca, Surya Saputra, Dennis Adhiswara, Oka Antara",Indonesia,"March 27, 2019",2008,TV-PG,126 min,"Dramas, International Movies, Romantic Movies","Polygamy, piety and personal principles collide for a charming and congenial young university student struggling in a four-way love triangle."
s7529,Movie,Welcome to Sajjanpur,Shyam Benegal,"Shreyas Talpade, Amrita Rao, Ravi Kishan, Ila Arun, Rajeshwari Sachdev, Divya Dutta, Yashpal Sharma, Ravi Jhankal, Lalit Mohan Tiwari",India,"November 1, 2018",2008,TV-14,131 min,"Comedies, Dramas, International Movies","An educated man assists the illiterate residents of his village with written correspondence, sometimes manipulating the letters to suit his interests."
s7620,Movie,Wild Child,Nick Moore,"Emma Roberts, Kimberley Nixon, Juno Temple, Linzey Cocker, Sophie Wu, Alex Pettyfer, Georgia King, Natasha Richardson, Aidan Quinn, Lexi Ainsworth","United States, United Kingdom, France","November 1, 2019",2008,PG-13,98 min,"Comedies, Romantic Movies","When a spoiled girl pushes her father too far with her spending and outlandish behavior, he ships the Malibu princess off to a strict boarding school."
s7692,Movie,Y.M.I.: Yeh Mera India,N. Chandra,"Anupam Kher, Atul Kulkarni, Aakash Pandey, Milind Gunaji, Perizaad Zorabian, Smiley Suri, Parvin Dabas, Rajit Kapoor, Purab Kohli, Rajpal Yadav, Sarika, Sayaji Shinde, Seema Biswas, Vijay Raaz, Ashwin Mushran, Veerendra Saxena, Siddhant Karnick",India,"March 1, 2018",2008,TV-MA,137 min,"Dramas, Independent Movies, International Movies","The lives of a middle-aged soap opera addict, an ambitious career woman, a fervent activist and nine others from different walks of Indian life intersect in Mumbai. But this vibrant melting pot threatens to bubble over with bias and bigotry."
s7706,Movie,Yes Man,Peyton Reed,"Jim Carrey, Zooey Deschanel, Bradley Cooper, John Michael Higgins, Rhys Darby, Danny Masterson, Fionnula Flanagan, Terence Stamp, Sasha Alexander, Molly Sims","United States, United Kingdom","January 1, 2020",2008,PG-13,104 min,"Comedies, Romantic Movies","After a bitter divorce, a bank drone falls under the sway of a self-help guru who urges him to say yes to everything that comes his way for a year."
s7729,Movie,You Don't Mess with the Zohan,Dennis Dugan,"Adam Sandler, John Turturro, Emmanuelle Chriqui, Nick Swardson, Lainie Kazan, Ido Mosseri, Rob Schneider, Dave Matthews, Michael Buffer, Charlotte Rae",United States,"September 1, 2019",2008,UR,113 min,"Action & Adventure, Comedies",An Israeli counterterrorism soldier with a secretly fabulous ambition to become a Manhattan hairstylist will do anything to make his dreams come true.
s7734,TV Show,You're My Destiny,,"Joe Chen, Ethan Juan, Baron Chen, Bianca Bai, Wei-hsun Na, Tan Ai-Chen",Taiwan,"August 1, 2016",2008,TV-MA,1 Season,"International TV Shows, Romantic TV Shows, TV Comedies","A young woman's romantic cruise ends in a twist when she gets pregnant after a one-night stand with a rich executive, turning their lives upside down."
