show_id,type,title,director,cast,country,date_added,release_year,rating,duration,listed_in,description
s759,Movie,Basic Instinct,Paul Verhoeven,"Michael Douglas, Sharon Stone, George Dzundza, Jeanne Tripplehorn, Denis Arndt, Leilani Sarelle, Bruce A. Young, Chelcie Ross, Dorothy Malone, Wayne Knight, Daniel von Bargen, Stephen Tobolowsky","United States, France","October 1, 2020",1992,R,128 min,"Classic Movies, Thrillers",A detective investigating a rock star's brutal murder becomes drawn to the prime suspect — a mysterious novelist whose recent book mirrors the crime.
s796,Movie,Bebe's Kids,Bruce W. Smith,"Faizon Love, Vanessa Bell Calloway, Wayne Collins, Jonell Green, Marques Houston, Tone-Loc, Myra J., Nell Carter",United States,"November 20, 2019",1992,PG-13,73 min,Comedies,"When ladies' man Robin meets Jamika, he falls head over heels, but she greets him with four surprises: her son and her girlfriend Bebe's three kids."
s922,Movie,Bill Hicks: Relentless,Chris Bould,Bill Hicks,United Kingdom,"December 31, 2018",1992,TV-MA,61 min,Stand-Up Comedy,"In one of his most iconic performances, late comedian Bill Hicks demonstrates what made him such a singular talent and a force to be reckoned with."
s1201,Movie,Candyman,Bernard Rose,"Virginia Madsen, Tony Todd, Xander Berkeley, Kasi Lemmons, Vanessa Williams, DeJuan Guy, Michael Culkin, Stanley DeSantis","United States, United Kingdom","October 1, 2019",1992,R,99 min,"Cult Movies, Horror Movies","Grad student Helen Lyle unintentionally summons the Candyman, a hook-handed creature made flesh by other people's belief in him."
s1236,Movie,Casino Tycoon,Wong Jing,Wong Jing,Hong Kong,"August 1, 2018",1992,TV-MA,125 min,"Action & Adventure, Dramas, International Movies","When Japanese troops invade Hong Kong, young Benny Ho flees to Macau and rises to the top of the city's casino business with pluck, diligence and wit."
s1237,Movie,Casino Tycoon 2,Wong Jing,Dennis Chan,Hong Kong,"August 16, 2018",1992,TV-MA,108 min,"Action & Adventure, Dramas, International Movies",Casino mogul Benny Ho wields enormous power. But a feud with his former partner and a massive fraud scheme soon threaten his family and his empire.
s1268,Movie,Chamatkar,Rajiv Mehra,"Shah Rukh Khan, Naseeruddin Shah, Urmila Matondkar, Malvika Tiwari, Shammi Kapoor, Deven Verma, Tinnu Anand, Anjana Mumtaz, Anjan Srivastav, Rakesh Bedi",India,"May 15, 2017",1992,TV-14,164 min,"Comedies, International Movies, Sci-Fi & Fantasy","A village schoolteacher and the ghost of a murdered man, who were both betrayed by those closest to them, join forces to help each other."
s1301,TV Show,Cheers,,"Ted Danson, Rhea Perlman, George Wendt, John Ratzenberger, Shelley Long, Kirstie Alley, Woody Harrelson, Kelsey Grammer, Nicholas Colasanto",United States," July 1, 2017",1992,TV-PG,11 Seasons,"Classic & Cult TV, TV Comedies","Sam Malone, an ex-baseball player turned bar owner, operates a saloon that's always filled with quirky customers and even more eccentric staff."
s1598,TV Show,Danger Mouse: Classic Collection,,"David Jason, Terry Scott, Edward Kelsey, Brian Trueman",United Kingdom,"June 15, 2015",1992,TV-Y,10 Seasons,"British TV Shows, Kids' TV, TV Comedies","Follow the adventures of superspy Danger Mouse and his bumbling sidekick, Penfold, as they jet around the world foiling their enemies' evil plots."
s1703,Movie,Denis Leary: No Cure For Cancer,Ted Demme,Denis Leary,United States,"August 8, 2017",1992,R,62 min,Stand-Up Comedy,"In the stand-up performance that made him a legend, comedian Denis Leary caustically holds forth on nonsmokers, vegetarians and other undesirables."
s2854,Movie,Howards End,James Ivory,"Anthony Hopkins, Vanessa Redgrave, Helena Bonham Carter, Emma Thompson, James Wilby, Samuel West, Jemma Redgrave, Joseph Bennett, Nicola Duffett, Susie Lindeman","United Kingdom, Japan, United States","March 16, 2017",1992,PG,143 min,"Classic Movies, Dramas, Independent Movies","When a husband, acting in his family's ""best interest,"" does not accept his wife's deathbed wish, providence dictates that he pay for his duplicity."
s3256,Movie,"Justice, My Foot!",Johnnie To,"Stephen Chow, Anita Mui, Carrie Ng, Wai Ai, Benjamin Chan, Ka Sang Cheung, Wing Cho, Paul Chun, Eddy Ko, Chi Ming Lau",Hong Kong,"August 31, 2018",1992,TV-14,95 min,"Action & Adventure, Comedies, International Movies",Slick lawyer Sung fears he's been cursed with bad karma and considers giving up his practice – until he's approached by a widow accused of murder.
s3640,Movie,Like Water for Chocolate,Alfonso Arau,"Marco Leonardi, Lumi Cavazos, Regina Torné, Mario Iván Martínez, Ada Carrasco, Yareli Arizmendi, Claudette Maillé, Pilar Aranda",Mexico,"November 1, 2019",1992,R,105 min,"Classic Movies, Dramas, International Movies","When Pedro marries her sister, Tita throws herself into her cooking – and discovers she can transfer her emotions through the food she prepares."
s4787,Movie,Passenger 57,Kevin Hooks,"Wesley Snipes, Bruce Payne, Tom Sizemore, Alex Datcher, Bruce Greenwood, Elizabeth Hurley, Michael Horse, Marc Macaulay, Ernie Lively",United States,"January 1, 2021",1992,R,84 min,Action & Adventure,Air marshal John Cutter must stop notorious terrorist Charles Rane from killing hostages on board a flight that should have delivered Rane to jail.
s4795,Movie,Patriot Games,Phillip Noyce,"Harrison Ford, Anne Archer, Patrick Bergin, Sean Bean, Thora Birch, James Fox, Samuel L. Jackson, Polly Walker, J.E. Freeman, James Earl Jones, Richard Harris",United States,"January 1, 2020",1992,R,117 min,Action & Adventure,CIA desk jockey Jack Ryan plunges into the heart of international terrorism after spoiling an assassination attempt on a British royal family member.
s5847,Movie,Strictly Ballroom,Baz Luhrmann,"Paul Mercurio, Tara Morice, Bill Hunter, Pat Thomson, Gia Carides, Peter Whitford, Barry Otto, John Hannan","Australia, United Kingdom","January 1, 2020",1992,PG,95 min,"Classic Movies, Comedies, Romantic Movies","Dumped by his partner just before a major dance competition, gifted hoofer Scott Hastings is forced to take a graceless neophyte as his new partner."
s6257,Movie,The Crying Game,Neil Jordan,"Stephen Rea, Miranda Richardson, Forest Whitaker, Jaye Davidson, Adrian Dunbar, Breffini McKenna, Joe Savino, Birdie Sweeney, Andree Bernard, Jim Broadbent","United Kingdom, Japan, United States","January 1, 2020",1992,R,112 min,"Classic Movies, Independent Movies, Thrillers","IRA terrorist Fergus bonds with his prisoner, Jody. Jody tells Fergus of his girlfriend, Dil, with whom Fergus later falls in love."
s6557,Movie,The Last Days of Chez Nous,Gillian Armstrong,"Lisa Harrow, Bruno Ganz, Kerry Fox, Miranda Otto, Kiri Paramore, Bill Hunter",Australia,"November 1, 2016",1992,R,93 min,"Classic Movies, Dramas",Successful writer Beth's tepid marriage and home life face a new round of challenges when her footloose younger sister arrives for an extended visit.
